rcn,id,acronym,status,programme,topics,title,startDate,endDate,projectUrl,objective,totalCost,ecMaxContribution,coordinator,coordinatorCountry,participants,participantCountries
200098,699640,GIDDB,SIGNED,H2020-EU.2.3.2.,INNOSUP-5-2014,New practices of Grassroots Innovation for Demand Driven Businesses,2016-02-01T00:00:00Z,2016-10-31T00:00:00Z,http://www.arti.puglia.it/progetti-internazionali/grassroots-innovation-for-demand-driven-businesses,The present proposal regards the design of new models of intervention aimed at supporting bottom-up innovations and competiveness in SMEs founded by the young through the growth of entrepreneurial/managerial skills of young innovators the improvement of networking opportunities for start-uppers and the development of grassroots innovations,50000,50000,AGENZIA REGIONALE PER LA TECNOLOGIA E L'INNOVAZIONE,IT,FUNDACION FUNDECYT - PARQUE CIENTIFICO Y TECNOLOGICO DE EXTREMADURA-IFKA IPARFEJLESZTESI KOZHASZNU NONPROFIT KORLATOLT FELELOSSEGU TARSASAG,ES-HU
222564,831730,CE2019,SIGNED,H2020-EU.3.5.4.,IBA-SC5-PRESIDENCY-2018,The sustainable transition to a low carbon climate-resilient circular economy: Creating the knowledge base,2019-01-01T00:00:00Z,2019-12-31T00:00:00Z,,The aim of the project is to organize a conference The sustainable transition to a low carbon climate-resilient circular economy: Creating the knowledge base CE2019 in cooperation with the Finnish government,100000,100000,MINISTRY OF THE ENVIRONMENT,FI,,
222781,840978,BIZPOL,SIGNED,H2020-EU.1.3.2.,MSCA-IF-2018,Business as political actor – evolving practice emerging norms and shifting expectations for a pivotal determinant of public trust in both business and democracy (BIZPOL),2019-05-01T00:00:00Z,2023-05-01T00:00:00Z,,Business as political actor –evolving practice emerging norms and shifting expectations for a pivotal determinant of public trust in both business and democracy (BIZPOL) BIZPOL deploys a mix of innovative multi-disciplinary approaches to substantially advance scholarly thinking as well as the practical policy debate on corporate political activity (CPA),328968,328968,COPENHAGEN BUSINESS SCHOOL,DK,,
210039,739580,ALPS INN3,SIGNED,H2020-EU.2.3.,H2020-SGA2-EEN,EEN Innovation Support Services for SMEs in North West Italy,2017-01-01T00:00:00Z,2018-12-31T00:00:00Z,http://www.een-italia.eu/,The project whose geographical coverage will be North-West Italy (3 regions : Piemonte Liguria and Valle dAosta) aims at roviiding and upgrading a specific framework service for supporting SMEs in the innovation management capacity,210558.75,210558.75,CAMERA DI COMMERCIO INDUSTRIA ARTIGIANATO AGRICOLTURA DI TORINO,IT,UNIONCAMERE PIEMONTE-REGIONE LIGURIA-CONFINDUSTRIA PIEMONTE-UNIONCAMERE LIGURIA-REGIONE PIEMONTE,IT
217204,827826,CreamOlive,CLOSED,H2020-EU.3.+H2020-EU.2.3.+H2020-EU.2.1.,EIC-SMEInst-2018-2020,Industrial scale-up of the first all-natural solid fat based on olive oil to produce healthier bakery foods,2018-07-01T00:00:00Z,2018-12-31T00:00:00Z,http://www.midapiu.it/,The CreamOlive project addresses the global need of healthy and high-quality production of bakery food by introThe CreamOlive project addresses the global need of healthy and high-quality production of bakery food by introducing the first all-natural fat based on olive oil which is solid at room temperature thus making it suitable to large industrial processes,71429,50000,MIDA PIU SRL,IT,,
218885,835509,NEFERTITI,CLOSED,H2020-EU.3.+H2020-EU.2.3.+H2020-EU.2.1.,EIC-SMEInst-2018-2020,NEFERTITI: A Novel Eco-Friendly dually Efficient and Resistance-free Treatment of vaginITIs,2018-12-01T00:00:00Z,2019-05-31T00:00:00Z,http://gedeabiotech.com/,This project will develop a business plan to guide clinical validation and commercialization of pHyph a novel treatment targeting vaginal yeast and bacterial infections,71429,50000,GEDEA BIOTECH AB,SE,,
217391,826775,PureWater,CLOSED,H2020-EU.3.+H2020-EU.2.3.+H2020-EU.2.1.,EIC-SMEInst-2018-2020,Feasibility study for industrial scale-up of the novel high-efficiency biocompatible and easy-to-operate water treatment membrane.,2018-08-01T00:00:00Z,2019-01-31T00:00:00Z,http://www.bluact.com,The main objective of the PureWater project is the verification of technological and business viability of a novel disruptive and universally adoptable water purification technology possessing close to 100% efficiency and not requiring capital investments,71429,50000,BLUACT TECHNOLOGIES GMBH,CH,,
196240,663198,BLACKBINDER,CLOSED,H2020-EU.2.1.1.+H2020-EU.2.3.1.,ICT-37-2014-1,Black Binder all-in System of Digital Scores,2015-03-01T00:00:00Z,2015-08-31T00:00:00Z,http://www.blackbinder.net,Musicians play the scores basically like they did 200 years ago,71429,50000,NEWMUSICNOW SL,ES,,
225345,878286,CL Platform,CLOSED,H2020-EU.3.+H2020-EU.2.3.+H2020-EU.2.1.,EIC-SMEInst-2018-2020,Powering simplified and scalable mortgage application processing.,2019-07-01T00:00:00Z,2019-12-31T00:00:00Z,https://www.creditlogic.ie/,CL Platform is a mortgage application platform that simplifies the mortgage application process for mortgage advisors mortgage lenders and consumers,71429,50000,CREDITLOGIC LIMITED,IE,,
200206,694045,CyPod,CLOSED,H2020-EU.1.1.,ERC-PoC-2015,On-Chip Cytometry Printed On Demand,2016-03-01T00:00:00Z,2017-08-31T00:00:00Z,,Cytometry (the characterisation and counting of cells) is essential to clinical diagnostics biotechnology food industry water monitoring and many fields of research,150000,150000,UNIVERSITEIT TWENTE,NL,,
211169,774118,AEROPCM,CLOSED,H2020-EU.3.3.+H2020-EU.2.1.1.+H2020-EU.2.3.1.,SMEInst-09-2016-2017,ELASTOMERIC COMPOUND WITH PHASE CHANGE MATERIALS INTEGRATED TO STATE OF ART THERMAL INSULATION PANEL (AEROPAN) TO IMPROVE ENERGY SAVING AND CO2 EMISSION REDUCTION IN CIVIL AND INDUSTRIAL BUILDINGS,2017-06-01T00:00:00Z,2017-11-30T00:00:00Z,http://www.novurania.it/index.php,AEROPCM project aims at developing testing and marketing a breakthrough PCM-aerogel hybrid insulation panel,71429,50000,NOVURANIA SPA,IT,,
205370,713732,MESOTAS-SIEVE,SIGNED,H2020-EU.1.1.,ERC-PoC-2015,Sieving neuronal network communication,2016-10-01T00:00:00Z,2018-03-31T00:00:00Z,,This project will demonstrate the technical and commercial viability of the MESOTAS-SIEVE bioreactor a novel 3D brain-on-chip microculture system,150000,150000,TECHNISCHE UNIVERSITEIT EINDHOVEN,NL,,
231293,959271,DesImO,SIGNED,H2020-EU.2.3.2.2.,INNOSUP-05-2018-2020,Design Impact Observatory,2021-02-01T00:00:00Z,2022-01-31T00:00:00Z,,The main objective of the project is to collaboratively address a common innovation support challenge through the concept of the Twinning\ methodology,50000,50000,BUSINESS AND CULTURAL DEVELOPMENT CENTRE,EL,DESIGN SOCIETY FOND-CARDIFF METROPOLITAN UNIVERSITY-MITTETULUNDUSUHING EESTI DISAINIKESKUS,DK-UK-EE
220682,819227,FUMI,SIGNED,H2020-EU.1.1.,ERC-2018-COG,Future Migration as Present Fact,2019-07-01T00:00:00Z,2024-06-30T00:00:00Z,,The springboard for this project is a striking statistic: half of all young adults in West Africa wish to leave their own country and settle elsewhere,1999672,1999672,INSTITUTT FOR FREDSFORSKNING,NO,,
223520,868035,ATTAVIK,CLOSED,H2020-EU.3.+H2020-EU.2.3.+H2020-EU.2.1.,EIC-SMEInst-2018-2020,A game-changer solution for affordable mobile and Internet communications in areas with poor coverage,2019-05-01T00:00:00Z,2019-08-31T00:00:00Z,,Todays society relies on different wireless communication systems accessed from mobile devices: for quotidian tasks leisure time and also for critical emergencies,71429,50000,ATTAVIK A/S,DK,,
196453,672591,DISA,CLOSED,H2020-EU.2.1.1.+H2020-EU.2.3.1.,ICT-37-2014-1,medical Diagnosis Support Armchair project,2015-05-01T00:00:00Z,2015-10-31T00:00:00Z,http://www.streamvision.com,The Diagnosis Support Armchair project aims at collecting in a very short time (7minutes max,71429,50000,STREAM VISION,FR,,
204600,735781,FAST,CLOSED,H2020-EU.2.1.5.+H2020-EU.2.1.3.+H2020-EU.2.3.1.+H2020-EU.2.1.2.,SMEInst-02-2016-2017,Functionality by Structure,2016-07-01T00:00:00Z,2016-12-31T00:00:00Z,http://www.nilt.com/429/projects,There is an immediate need from the European plastics industry to add value to everyday products and to advance the moulding technology,71429,50000,NIL TECHNOLOGY APS,DK,,
213182,780960,AirBorne,SIGNED,H2020-EU.2.1.1.,ICT-25-2016-2017,AerIal RoBotic technologies for professiOnal seaRch aNd rescuE,2018-01-01T00:00:00Z,2020-12-31T00:00:00Z,http://www.airborne-project.eu,AirBorne is a high tech social innovation targeted to Search and Rescue (S&R) organizations operating in mountains to increase safety in tourism and leisure activities key for European mountaineer communities,2931193.75,2295998.13,ALMA MATER STUDIORUM - UNIVERSITA DI BOLOGNA,IT,RECCO AKTIEBOLAG-X-LOG ELEKTRONIK GMBH-CLUB ALPINO ITALIANO - C.A.I. ASSOCIAZIONE-SALA ANDREA-PLUSVALUE,SE-DE-IT-UK
205759,713735,EMODI,CLOSED,H2020-EU.1.1.,ERC-PoC-2015,Epithelial resistance modulation to treat disease,2016-10-01T00:00:00Z,2018-03-31T00:00:00Z,,Epithelial barriers are essential for organisms homeostasis and survival,147500,147500,UNIVERSIDADE NOVA DE LISBOA,PT,,
217713,817296,eDCaseMAN,CLOSED,H2020-EU.3.+H2020-EU.2.3.+H2020-EU.2.1.,EIC-SMEInst-2018-2020,Defendable legal cases through an affordable easy integrated and reliable case management software,2018-05-01T00:00:00Z,2018-09-30T00:00:00Z,https://brite.ch/ https,Electronic discovery (known as e-discovery) is the electronic aspect of identifying collecting and producing electronically stored information (ESI) in response to a request in a lawsuit or investigation,71429,50000,BRITE GMBH,CH,,
213403,759424,SUEE,SIGNED,H2020-EU.1.1.,ERC-2017-STG,Strategic Uncertainty in Economic Environments,2018-02-01T00:00:00Z,2023-01-31T00:00:00Z,,This proposal concerns two sets of projects that tackle theoretical challenges raised by the data broker and online advertisement industry,1480325,1480325,UNIVERSIDAD POMPEU FABRA,ES,,
223862,851876,CLIMEX,SIGNED,H2020-EU.1.2.1.,FETOPEN-03-2018-2019-2020,Climate Exposure Tool for Financial Risk Analysis,2019-05-01T00:00:00Z,2020-10-31T00:00:00Z,,CLIMEX will bring to the market an innovative commercial product based on the research output of the FET research Project DOLFINS i,99750,99750,UNIVERSITAT ZURICH,CH,CLIMATE FINANCE ALPHA-ECOLE D'ECONOMIE DE PARIS,FR
204382,728860,Tom PIT Studio,CLOSED,H2020-EU.2.1.1.+H2020-EU.2.3.1.,SMEInst-01-2016-2017,Tom PIT Studio - platform for designing information systems,2016-06-01T00:00:00Z,2016-10-31T00:00:00Z,http://www.tompit.net,Pharmaceutical sector demands information systems (IS) to be custom designed and in compliance with Good manufacturing practice (GMP) regulative,71429,50000,TOM PIT RAZVOJ PROGRAMSKE OPREME DOO,SI,,
218809,814332,IEWSofia2018,CLOSED,H2020-EU.2.2.,IBA-ARF-Bulgaria-2018,Innovative Enterprise week SOFIA 2018 - Financial instruments fostering Research and Innovation,2018-02-01T00:00:00Z,2018-07-31T00:00:00Z,https://www.innoweeksofia2018.eu/,The Innovative Enterprise week SOFIA 2018 (IEWSofia2018) will plan prepare and organize a 1 day conference the Innovative Enterprise week SOFIA 2018 - Financial instruments fostering Research and Innovation to raise awareness of the potential for the financial instruments facilities and accompanying measures launched in particular under Horizon 2020 to enhance access to finance for research and innovation,149750,149750,TECH TOUR GLOBAL,BG,,
213879,808713,VILT-DEV,CLOSED,H2020-EU.3.6.+H2020-EU.2.3.1.,SMEInst-12-2016-2017,Virtual Instructor-Led IT Developer Training Program,2018-03-01T00:00:00Z,2018-08-31T00:00:00Z,https://oclock.io/infos/supporters/instrument-pme,With at least one million unfilled IT developer jobs worldwide the digital sector represents a substantial opportunity for professional training entities to positively impact socio-economic technological and pedagogical challenges,71429,50000,O'CLOCK,FR,,
211383,724231,DIVERSE-EXPECON,SIGNED,H2020-EU.1.1.,ERC-2016-COG,Discriminative preferences and fairness ideals in diverse societies: An ‘experimental economics’ approach,2018-01-01T00:00:00Z,2022-12-31T00:00:00Z,,In economics a distinction is made between statistical and taste-based discrimination (henceforth TBD),1499046,1499046,STICHTING KATHOLIEKE UNIVERSITEIT BRABANT,NL,,
210598,754362,MathInParis,SIGNED,H2020-EU.1.3.4.,MSCA-COFUND-2016,International Doctoral Training in Mathematical Sciences in Paris,2017-09-01T00:00:00Z,2022-08-31T00:00:00Z,https://www.sciencesmaths-paris.fr/fr/cofund-mathinparis-842.htm,COFUND MathInParis programme will create and build upon existing networks to attract exceptional Doctoral students coming from abroad to ensure a very high standard of Doctoral training and to disseminate good practice in terms of selection and mentoring throughout all its Doctoral schools by means of those implemented within this programme,6278400,3139200,FONDATION SCIENCES MATHEMATIQUES DE PARIS,FR,,
200493,693455,InInVi,SIGNED,H2020-EU.1.1.,ERC-PoC-2015,Automatically Interactivised and Individualised Videos,2016-03-01T00:00:00Z,2017-08-31T00:00:00Z,,InInVi originates from augmented reality (AR) research within the ERC project VarCity,149876,149876,EIDGENOESSISCHE TECHNISCHE HOCHSCHULE ZUERICH,CH,UNIQFEED AG,CH
216500,786580,MACI,SIGNED,H2020-EU.1.1.,ERC-2017-ADG,Moduli Algebraic Cycles and Invariants,2018-09-01T00:00:00Z,2023-08-31T00:00:00Z,https://people.math.ethz.ch/,Algebraic geometry is the study of varieties -- the zero sets of polynomial equations in several variables,2496055,2496055,EIDGENOESSISCHE TECHNISCHE HOCHSCHULE ZUERICH,CH,,
228451,890488,EuTropRisk,SIGNED,H2020-EU.1.3.2.,MSCA-IF-2019,Tropical cyclones generated by tropical transition over the North Atlantic Ocean and their potential hazards for Europe,2021-04-01T00:00:00Z,2023-03-31T00:00:00Z,,During the last 15 years the eastern North Atlantic has witnessed anomalous tropical cyclones (TCs) generated by the tropical transition (TT) process some of them affecting or threatening European regions causing societal damage and public concern,191149.44,191149.44,EIDGENOESSISCHE TECHNISCHE HOCHSCHULE ZUERICH,CH,,
227246,866004,Proteomes-in-3D,SIGNED,H2020-EU.1.1.,ERC-2019-COG,Three-dimensional dynamic views of proteomes as a novel readout for physiological and pathological alterations,2020-03-01T00:00:00Z,2025-02-28T00:00:00Z,,Protein expression screens are routinely used to identify biological processes deregulated upon disease development or upon specific cellular perturbations,2000000,2000000,EIDGENOESSISCHE TECHNISCHE HOCHSCHULE ZUERICH,CH,,
198483,670478,PLASILOR,SIGNED,H2020-EU.1.1.,ERC-ADG-2014,Plasmonic-Silicon-Organic Hybrid – a Universal Platform for THz Communications,2015-11-01T00:00:00Z,2020-10-31T00:00:00Z,http://www.plasilor.ief.ee.ethz.ch/,The PLASILOR project aims at combining the best of three worlds by bringing silicon organic and plasmonic technologies onto one common platform,2487475,2487475,EIDGENOESSISCHE TECHNISCHE HOCHSCHULE ZUERICH,CH,,
213466,771565,HINBOTS,SIGNED,H2020-EU.1.1.,ERC-2017-COG,Highly Integrated Nanoscale Robots for Targeted Delivery to the Central Nervous System,2018-09-01T00:00:00Z,2023-08-31T00:00:00Z,,Over the past two decades researchers have been working to create synthetic small-scale machines ranging from molecular entities or miniaturized structures to more complex assemblies of micro- and nanomaterials,1998720,1998720,EIDGENOESSISCHE TECHNISCHE HOCHSCHULE ZUERICH,CH,,
227530,886102,HaloCat,SIGNED,H2020-EU.1.3.2.,MSCA-IF-2019,Elemental Halogen-Free Reversible Construction and Deconstruction of 12-Dihalides via Shuttle Catalysis,2020-06-01T00:00:00Z,2022-05-31T00:00:00Z,,Multi-halogenated compounds play a significant role in our daily life as they are not only widely used as materials pharmaceuticals and agrochemicals but also serve as practical and indispensable building blocks in the chemical industry,203149.44,203149.44,EIDGENOESSISCHE TECHNISCHE HOCHSCHULE ZUERICH,CH,,
220335,812765,NU-SPINE,SIGNED,H2020-EU.1.3.1.,MSCA-ITN-2018,Training innovative future leaders in research and development of materials and implants for the spine,2019-01-01T00:00:00Z,2022-12-31T00:00:00Z,,This proposal aims to develop Early-Stage Researchers into innovative European leaders in biomedical engineering with a focus on spinal devices,4272380.36,4272380.36,UPPSALA UNIVERSITET,SE,CERAMTEC GMBH-IHI IONBOND AG-KEY ENGINEERING SOLUTIONS LIMITED-UNIVERSITY OF LEEDS-EIDGENOESSISCHE TECHNISCHE HOCHSCHULE ZUERICH,DE-CH-UK
222832,842621,DIGDEEP,SIGNED,H2020-EU.1.3.2.,MSCA-IF-2018,Digging deeper into genes to track infectious disease outbreaks,2020-09-01T00:00:00Z,2022-08-31T00:00:00Z,,Successful public and animal health interventions require detailed knowledge of infectious disease transmission dynamics in particular how they spread within and between populations,203149.44,203149.44,EIDGENOESSISCHE TECHNISCHE HOCHSCHULE ZUERICH,CH,,
220863,818179,EngineeringBAP,SIGNED,H2020-EU.1.1.,ERC-2018-COG,Engineering brain activity patterns for therapeutics of neuropsychiatric and neurological disorders,2019-10-01T00:00:00Z,2024-09-30T00:00:00Z,,Neuropsychiatric and neurological disorders are complex dysfunctions of neuronal circuits,1998984,1998984,EIDGENOESSISCHE TECHNISCHE HOCHSCHULE ZUERICH,CH,,
200747,679843,WINDMIL,SIGNED,H2020-EU.1.1.,ERC-StG-2015,Smart Monitoring Inspection and Life-Cycle Assessment of Wind Turbines,2016-05-01T00:00:00Z,2021-04-30T00:00:00Z,http://www.chatzi.ibk.ethz.ch/erc-stg-windmil.html,The excessive energy consumption that Europe is faced with calls for sustainable resource management and policy-making,1486224,1486224,EIDGENOESSISCHE TECHNISCHE HOCHSCHULE ZUERICH,CH,,
230661,949219,DEPO,SIGNED,H2020-EU.1.1.,ERC-2020-STG,Reversing Controlled Radical Polymerisation: Towards Complete Depolymerisation,2020-09-01T00:00:00Z,2025-08-31T00:00:00Z,,Controlled radical polymerisation has revolutionised the field of polymer chemistry by allowing access to the synthesis of a wide range of materials with controlled molecular weight dispersity architecture and end-group fidelity,1491260,1491260,EIDGENOESSISCHE TECHNISCHE HOCHSCHULE ZUERICH,CH,,
220811,803491,BRITE,SIGNED,H2020-EU.1.1.,ERC-2018-STG,Elucidating the molecular mechanisms underlying brite adipocyte specification and activation,2019-03-01T00:00:00Z,2024-02-29T00:00:00Z,,Brown adipocytes can dissipate energy in a process called adaptive thermogenesis,1552620,1552620,EIDGENOESSISCHE TECHNISCHE HOCHSCHULE ZUERICH,CH,,
216506,787097,ONE-MIX,SIGNED,H2020-EU.1.1.,ERC-2017-ADG,Mid-infrared optical dual-comb generation and spectroscopy with one unstabilized semiconductor laser,2019-01-01T00:00:00Z,2024-06-30T00:00:00Z,,ONE-MIX proposes to develop single-source dual-comb lasers for mid-infrared (2-5 μm wavelength) spectroscopy potentially enabling many new applications in science and industry such as environment safety pharma and health,3210000,3210000,EIDGENOESSISCHE TECHNISCHE HOCHSCHULE ZUERICH,CH,,
204854,694955,INSEETO,SIGNED,H2020-EU.1.1.,ERC-ADG-2015,In-situ second harmonic generation for emergent electronics in transition-metal oxides,2017-01-01T00:00:00Z,2021-12-31T00:00:00Z,http://www.ferroic.mat.ethz.ch/research/inseeto.html,Since transition-metal oxides heterostructures can be grown by pulsed laser deposition (PLD) with semiconductor-like accuracy fascinating phases and functionalities derived from their spin-charge correlations have been discovered,2498714,2498714,EIDGENOESSISCHE TECHNISCHE HOCHSCHULE ZUERICH,CH,,
224953,863132,IQLev,SIGNED,H2020-EU.1.2.1.,FETOPEN-01-2018-2019-2020,Inertial Sensing Based on Quantum-Enhanced Levitation Systems,2020-01-01T00:00:00Z,2022-12-31T00:00:00Z,,Information and data are becoming increasingly important both to European society and to the European economy,2612471.25,2612471.25,EIDGENOESSISCHE TECHNISCHE HOCHSCHULE ZUERICH,CH,IXBLUE-FUNDACIO INSTITUT DE CIENCIES FOTONIQUES-UNIVERSITAT WIEN-UNIVERSITAET INNSBRUCK,FR-ES-AT
229388,883077,SYMBIOSES,SIGNED,H2020-EU.1.1.,ERC-2019-ADG,Novel Symbioses,2021-01-01T00:00:00Z,2025-12-31T00:00:00Z,,The introduction of new functionalities into cells is a challenge but it offers tremendous opportunities,2500000,2500000,EIDGENOESSISCHE TECHNISCHE HOCHSCHULE ZUERICH,CH,,
207180,721675,RSPDE,SIGNED,H2020-EU.1.1.,ERC-2016-COG,Regularity and Stability in Partial Differential Equations,2017-02-01T00:00:00Z,2022-01-31T00:00:00Z,https://people.math.ethz.ch/,This project focuses on several problems in Partial Differential Equations (PDEs) and the Calculus of Variations,1742428,1742428,EIDGENOESSISCHE TECHNISCHE HOCHSCHULE ZUERICH,CH,,
203237,681587,HybCell,SIGNED,H2020-EU.1.1.,ERC-CoG-2015,Engineering of hybrid cells using lab-on-chip technology,2016-07-01T00:00:00Z,2021-06-30T00:00:00Z,,The overall aim of the here described projects is to learn fundamental characteristics of cellular organization and compartmentalization in particular the role of the lipid membrane and to exploit this knowledge for engineering minimal cells with a great impact in the context of synthetic biology and also for pharmaceutical and medical applications,1971250,1971250,EIDGENOESSISCHE TECHNISCHE HOCHSCHULE ZUERICH,CH,,
204547,708349,SPCOLPS,CLOSED,H2020-EU.1.3.2.,MSCA-IF-2015-EF,Self-propelled colloidal particles: single particle motion and collective behavior,2016-09-01T00:00:00Z,2018-08-31T00:00:00Z,https://sites.google.com/view/colloidal-designer-matter-rao/home,Active materials present us with interesting possibilities for the design of materials and devices yet they also introduce some scientific and technological challenges,175419.6,175419.6,EIDGENOESSISCHE TECHNISCHE HOCHSCHULE ZUERICH,CH,,
218559,794207,ASIQS,SIGNED,H2020-EU.1.3.2.,MSCA-IF-2017,Antiferromagnetic spintronics investigated by quantum sensing techniques,2019-01-01T00:00:00Z,2020-12-31T00:00:00Z,,This project proposes to study the processes of the antiferromagnetic materials in terms of high spatial and time resolutions in order to understand the microscopical mechanisms of the magnetization reversal,175419.6,175419.6,EIDGENOESSISCHE TECHNISCHE HOCHSCHULE ZUERICH,CH,,
227900,891710,SPATULA,SIGNED,H2020-EU.1.3.2.,MSCA-IF-2019,Sensitive spatially resolved U-Th dating approach using LA-ICPMS,2020-07-01T00:00:00Z,2022-06-30T00:00:00Z,,The U-Th dating system is broadly exploited to determine the timing and process of Earths geological environmental and biotic evolution for materials as young as few years to over the last 800 thousand years (kyrs),203149.44,203149.44,EIDGENOESSISCHE TECHNISCHE HOCHSCHULE ZUERICH,CH,,
213419,764547,DyVirt,SIGNED,H2020-EU.1.3.1.,MSCA-ITN-2017,Dynamic virtualisation: modelling performance of engineering structures,2018-02-01T00:00:00Z,2022-01-31T00:00:00Z,,The aim of this innovative training network is to train a new generation of early-stage researchers (ESRs) to face the urgent challenge of how to model the performance of engineering structures that operate in dynamic environments,3589794.64,3589794.64,THE UNIVERSITY OF SHEFFIELD,UK,AKADEMIA GORNICZO-HUTNICZA IM. STANISLAWA STASZICA W KRAKOWIE-SIEMENS GAMESA RENEWABLE ENERGY AS-SIEMENS INDUSTRY SOFTWARE NV-EIDGENOESSISCHE TECHNISCHE HOCHSCHULE ZUERICH-THE UNIVERSITY OF LIVERPOOL-PANEPISTIMIO THESSALIAS-GOTTFRIED WILHELM LEIBNIZ UNIVERSITAET HANNOVER,PL-DK-BE-CH-UK-EL-DE
219114,825310,NGI0-PET,SIGNED,H2020-EU.2.1.1.,ICT-24-2018-2019,NGI Zero - Privacy Enhancing Technologies,2018-11-01T00:00:00Z,2021-10-31T00:00:00Z,https://nlnet.nl/PET/,The NGI vision clearly identifies major social and economic challenges that need to be addressed urgently and articulates a powerful vision for a new phase of the internet,7000000,7000000,STICHTING NLNET,NL,Free Software Foundation Europe e.V.-STICHTING ACCESSIBILITY-PETITES SINGULARITES-TIMIT HOLDING BV-ASSOCIATION FOR PROGRESSIVE COMMUNICATIONS-CENTER FOR THE CULTIVATION OF TECHNOLOGY GEMEINNUTZIGE GMBH-INSTITUT FUR RECHTSFRAGEN DER FREIEN UND OPEN SOURCE SOFTWARE-EIDGENOESSISCHE TECHNISCHE HOCHSCHULE ZUERICH-RADICALLY OPEN SECURITY BV-COMMONS CARETAKERS BV-STICHTING NIXOS FOUNDATION-TRANSLATE HOUSE LTD,DE-NL-BE-US-CH-UK
220383,803363,FuncMAB,SIGNED,H2020-EU.1.1.,ERC-2018-STG,High-throughput single-cell phenotypic analysis of functional antibody repertoires,2019-02-01T00:00:00Z,2024-01-31T00:00:00Z,,Antibodies play an important role ensuring successful protection after vaccination,1500000,1500000,EIDGENOESSISCHE TECHNISCHE HOCHSCHULE ZUERICH,CH,ECOLE SUPERIEURE DE PHYSIQUE ET DECHIMIE INDUSTRIELLES DE LA VILLE DEPARIS,FR
230992,957545,POLARIS,SIGNED,H2020-EU.1.1.,ERC-2020-POC,Polarization tracking in situ,2020-09-01T00:00:00Z,2022-02-28T00:00:00Z,,The technology for the growth of thin oxide films has reached the same level of atomic control as in the case of semiconductors,,150000,EIDGENOESSISCHE TECHNISCHE HOCHSCHULE ZUERICH,CH,,
216557,786636,eDrop,SIGNED,H2020-EU.1.1.,ERC-2017-ADG,Droplet Photoelectron Imaging,2018-11-01T00:00:00Z,2023-10-31T00:00:00Z,,Angle-resolved photoelectron spectroscopy of aerosol droplets (droplet photoelectron imaging) is a novel approach to study fundamental aspects of the electron dynamics in liquids and across interfaces,2500000,2500000,EIDGENOESSISCHE TECHNISCHE HOCHSCHULE ZUERICH,CH,,
220155,818195,IONPEN,SIGNED,H2020-EU.1.1.,ERC-2018-COG,Trapped-ion quantum information in 2-dimensional Penning trap arrays,2019-04-01T00:00:00Z,2024-03-31T00:00:00Z,,This project will develop a new platform for quantum computation and quantum simulation based on scalable two-dimensional arrays of ions in micro-fabricated Penning traps,1999375,1999375,EIDGENOESSISCHE TECHNISCHE HOCHSCHULE ZUERICH,CH,,
