rcn,id,acronym,status,programme,topics,title,startDate,endDate,projectUrl,objective,totalCost,ecMaxContribution,coordinator,coordinatorCountry,participants,participantCountries
201304,705217,UPR,SIGNED,H2020-EU.1.3.2.,MSCA-IF-2015-GF,Unconditional parental regard: Its nature and its consequences,2016-06-01T00:00:00Z,2018-05-31T00:00:00Z,https://eddiebrummelman.com/,Unconditional parental regard refers to parents accepting children for who they are even when they disapprove of childrens achievements (eg school grades),162864.6,162864.6,UNIVERSITEIT VAN AMSTERDAM,NL,,
215046,792202,LOFUPRO,CLOSED,H2020-EU.1.3.2.,MSCA-IF-2017,The Logical Function of Property Talk,2018-10-01T00:00:00Z,2020-09-30T00:00:00Z,https://www.thomasschindler.org/home/msca-project,Properties are those things that we attribute to objects such as the property of being red or the property of being a prime number,165598.8,165598.8,UNIVERSITEIT VAN AMSTERDAM,NL,,
193633,639217,CSINEUTRONSTAR,SIGNED,H2020-EU.1.1.,ERC-StG-2014,The physics and forensics of neutron star explosions,2015-06-01T00:00:00Z,2020-05-31T00:00:00Z,https://staff.fnwi.uva.nl/a.l.watts/,Neutron stars offer a unique environment in which to develop and test theories of the strong force,1499999,1499999,UNIVERSITEIT VAN AMSTERDAM,NL,,
225067,841188,AAT,SIGNED,H2020-EU.1.3.2.,MSCA-IF-2018,Appraising and accelerating theoretical progress in memory modification research with meta-science Bayesian statistics and an open-collaborative approach.,2020-04-20T00:00:00Z,2022-04-19T00:00:00Z,,This fellowship will involve appraising and accelerating theoretical progress in memory modification research with Bayesian statistics collaboration and open science,175572.48,175572.48,UNIVERSITEIT VAN AMSTERDAM,NL,,
195250,656333,PEACEFUL MIND,CLOSED,H2020-EU.1.3.2.,MSCA-IF-2014-EF,Effectiveness evaluation of traditional and third wave Emotion Regulation strategies in clinical and non-clinical youth population,2016-04-01T00:00:00Z,2018-09-28T00:00:00Z,https://majawrzesien.com/,Mental-Health problems in youth such as disruptive behavioural disorders substances abuse aggressive behaviors depression anxiety etc,177598.8,177598.8,UNIVERSITEIT VAN AMSTERDAM,NL,,
230777,956107,EPOC,SIGNED,H2020-EU.1.3.1.,MSCA-ITN-2020,Economic Policy in Complex Environments,2021-03-01T00:00:00Z,2025-02-28T00:00:00Z,,Many of the main current economic and societal challenges in Europe are characterised by complex dynamic patterns stemming from path dependency irreversibility systemic risk and (local) interaction of heterogeneous agents,3982061.52,3982061.52,UNIVERSITAET BIELEFELD,DE,KOBENHAVNS UNIVERSITET-UNIVERSITA CA' FOSCARI VENEZIA-UNIVERSITE PARIS I PANTHEON-SORBONNE-UNIVERSIDAD AUTONOMA DE BARCELONA-UNIVERSITA CATTOLICA DEL SACRO CUORE-UNIVERSITEIT VAN AMSTERDAM,DK-IT-FR-ES-NL
226057,852990,N-EXTLAW,SIGNED,H2020-EU.1.1.,ERC-2019-STG,Law as Vehicle for Social Change: Mainstreaming Non-Extractive Economic Practices,2020-08-01T00:00:00Z,2025-07-31T00:00:00Z,,The current economic model is overdue for revision,1498733,1498733,UNIVERSITEIT VAN AMSTERDAM,NL,,
225599,853394,ALPHA,SIGNED,H2020-EU.1.1.,ERC-2019-STG,Assessing Legacies of Past Human Activities in Amazonia,2020-01-01T00:00:00Z,2024-12-31T00:00:00Z,,Amazon forests contribute vital ecosystem services including maintaining biodiversity (>10000 tree species) and storing large amounts of carbon,1481378,1481378,UNIVERSITEIT VAN AMSTERDAM,NL,UNIVERSITY OF LEEDS,UK
229284,897004,ISLand,SIGNED,H2020-EU.1.3.2.,MSCA-IF-2019,Isolation and Segregation Landscape. Archaeology of quarantine in the Indian Ocean World,2020-11-01T00:00:00Z,2023-10-31T00:00:00Z,,The proposed research presents an experimental and completely novel investigation within the historical archaeology applied to isolated contexts,253052.16,253052.16,UNIVERSITEIT VAN AMSTERDAM,NL,,
227898,892314,REWA,SIGNED,H2020-EU.1.3.2.,MSCA-IF-2019,Resource wars in an unequal world: international law and beyond,2021-02-01T00:00:00Z,2023-01-31T00:00:00Z,,The growing demand for resource commodities coupled with the climate crisis have increased pressures on ecosystems and individuals who are already at the margins of society,175572.48,175572.48,UNIVERSITEIT VAN AMSTERDAM,NL,,
193691,640159,MST,SIGNED,H2020-EU.1.1.,ERC-StG-2014,Moonshine and String Theory,2015-09-01T00:00:00Z,2021-02-28T00:00:00Z,,The purpose of the proposed research is to forward the understanding of the umbral moonshine discovered recently by myself,1256624,1256624,UNIVERSITEIT VAN AMSTERDAM,NL,,
197492,647209,Psychosystems,SIGNED,H2020-EU.1.1.,ERC-CoG-2014,Psychosystems: Consolidating Network Approaches to Psychopathology,2015-09-01T00:00:00Z,2021-08-31T00:00:00Z,http://www.psychosystems.org,I have recently introduced the Network Approach to Psychopathology,1959690,1959690,UNIVERSITEIT VAN AMSTERDAM,NL,,
218672,813547,MIDA,SIGNED,H2020-EU.1.3.1.,MSCA-ITN-2018,Mediating Islam in the Digital Age. Present issues and past experiences of technological revolutions,2019-03-01T00:00:00Z,2023-02-28T00:00:00Z,,We are witnessing the emergence of what is in very important ways essentially a new religion,3874112.28,3874112.28,CENTRE NATIONAL DE LA RECHERCHE SCIENTIFIQUE CNRS,FR,PHILIPPS UNIVERSITAET MARBURG-UNIVERSITEIT LEIDEN-STICHTING VU-STICHTING KATHOLIEKE UNIVERSITEIT-AGENCIA ESTATAL CONSEJO SUPERIOR DEINVESTIGACIONES CIENTIFICAS-GERMAN INSTITUTE FOR GLOBAL AND AREA STUDIES (GIGA)-FONDACIJA KULTURNO NASLIJEDE BEZ GRANICA-INSTITUT DE RECHERCHE POUR LE DEVELOPPEMENT-KATHOLIEKE UNIVERSITEIT LEUVEN-FREIE UNIVERSITAET BERLIN-UNIVERSITEIT VAN AMSTERDAM,DE-NL-ES-BA-FR-BE
224714,860665,PERFORCE3,SIGNED,H2020-EU.1.3.1.,MSCA-ITN-2019,Innovative Training Network on PER and polyfluorinated alkyl substances towards the Future Of Research and its Communication in Europe 3,2020-01-01T00:00:00Z,2023-12-31T00:00:00Z,,The PERFORCE3 European Training Network (ETN) is a multi-partner joint doctoral student research training network with the overall aims of educating 15 Early Stage Researchers (ESRs) and improving the understanding of and eliminating the risks associated with per- and polyfluoroalkyl substances (PFASs),4160995.92,4160995.92,STOCKHOLMS UNIVERSITET,SE,BUNDESINSTITUT FUER RISIKOBEWERTUNG-UNIVERSITETET I TROMSOE - NORGES ARKTISKE UNIVERSITET-HOCHSCHULE FRESENIUS GEMEINNUTZIGEGMBH-STICHTING VU-HELMHOLTZ-ZENTRUM FUR UMWELTFORSCHUNG GMBH - UFZ-THE UNIVERSITY OF BIRMINGHAM-NORSK INSTITUTT FOR LUFTFORSKNING STIFTELSE-SVERIGES LANTBRUKSUNIVERSITET-EIDGENOESSISCHE TECHNISCHE HOCHSCHULE ZUERICH-STIFTELSEN NORGES GEOTEKNISKE INSTITUTT-GE HEALTHCARE BIO-SCIENCES AB-KAROLINSKA INSTITUTET-UNIVERSITEIT VAN AMSTERDAM,DE-NO-NL-UK-SE-CH
196589,659193,Evolutionary Neurogenomics,CLOSED,H2020-EU.1.3.2.,MSCA-IF-2014-EF,The impact of recent retrotransposon invasions on the evolution of human neural gene expression,2015-06-01T00:00:00Z,2017-05-31T00:00:00Z,http://www.frankjacobslab.com,Throughout evolution primate genomes have been under attack by different classes of retrotransposons retrovirus-derived mobile DNA elements,177598.8,177598.8,UNIVERSITEIT VAN AMSTERDAM,NL,,
228699,898537,Shaping the conflict,SIGNED,H2020-EU.1.3.2.,MSCA-IF-2019,Shaping the conflict:  The role of judicial and humanitarian forensic knowledge in co-producing collective accounts of violence. A case study of the Colombian (post) conflict,2020-06-01T00:00:00Z,2022-05-31T00:00:00Z,,Social and academic inquiry on post-conflict societies has focused on victims and perpetrators with a recent interest in forensic specialists as expert witnesses,187572.48,187572.48,UNIVERSITEIT VAN AMSTERDAM,NL,,
209797,749510,NucLoc,CLOSED,H2020-EU.1.3.2.,MSCA-IF-2016,RNA localization in bacteria,2018-09-01T00:00:00Z,2020-08-31T00:00:00Z,,In eukaryotic cells mRNAs can be localized to specific places within a cell to achieve protein synthesis with spatiotemporal control,165598.8,165598.8,UNIVERSITEIT VAN AMSTERDAM,NL,,
220288,811285,Atlas,SIGNED,H2020-EU.1.1.,ERC-2018-PoC,Atlas,2019-03-01T00:00:00Z,2021-02-28T00:00:00Z,,The human subcortex is a highly crowded brain area which consists of hundreds of unique small grey matter nuclei constituting approximately ¼ of total human brain volume,150000,150000,UNIVERSITEIT VAN AMSTERDAM,NL,,
222922,845119,MeNDD,SIGNED,H2020-EU.1.3.2.,MSCA-IF-2018,Metaphorical Narratives in Dementia Discourse,2019-09-01T00:00:00Z,2021-08-31T00:00:00Z,,Research on dementia discourse has shown how our attitudes views and words have a positive or negative influence on the well-being of People Living With Dementia (PLWD),175572.48,175572.48,UNIVERSITEIT VAN AMSTERDAM,NL,,
204712,679399,PERCEPT,SIGNED,H2020-EU.1.1.,ERC-StG-2015,The mind's eye: How expectation and attention shape perception,2016-08-01T00:00:00Z,2021-07-31T00:00:00Z,,Perception is more than meets the eye how we see the world is critically shaped by attention (what is relevant) and as a growing body of work indicates by past experience (what is likely),1499938,1499938,STICHTING VU,NL,UNIVERSITEIT VAN AMSTERDAM,NL
197940,671653,EXTRA,CLOSED,H2020-EU.1.2.2.,FETHPC-1-2014,Exploiting eXascale Technology with Reconfigurable Architectures,2015-09-01T00:00:00Z,2018-08-31T00:00:00Z,http://extrahpc.eu,To handle the stringent performance requirements of future exascale High Performance Computing (HPC) applications HPC systems need ultra-efficient heterogeneous compute nodes,3989931.25,3989930.5,UNIVERSITEIT GENT,BE,THE CHANCELLOR MASTERS AND SCHOLARSOF THE UNIVERSITY OF CAMBRIDGE-IMPERIAL COLLEGE OF SCIENCE TECHNOLOGY AND MEDICINE-EREVNITIKO PANEPISTIMIAKO INSTITOUTO TILEPIKONONIAKON SYSTIMATON-SYNELIXIS LYSEIS PLIROFORIKIS AUTOMATISMOU & TILEPIKOINONION ANONIMI ETAIRIA-RUHR-UNIVERSITAET BOCHUM-POLITECNICO DI MILANO-MAXELER TECHNOLOGIES LIMITED-UNIVERSITEIT VAN AMSTERDAM,UK-EL-DE-IT-NL
228666,894547,MARMIGSEX,SIGNED,H2020-EU.1.3.2.,MSCA-IF-2019,Marriage Migration and Sexuality: African Migrants in Interracial Same-sex Partnerships,2021-08-01T00:00:00Z,2024-07-31T00:00:00Z,,In an interconnected world the introduction of same-sex marriage in many countries has also affected the lives of LGBTI persons outside their territories even where homosexuality is illegal,271052.16,271052.16,UNIVERSITEIT VAN AMSTERDAM,NL,,
224977,857897,e-LADDA,SIGNED,H2020-EU.1.3.1.,MSCA-ITN-2019,Early Language Development in the Digital Age,2019-11-01T00:00:00Z,2023-10-31T00:00:00Z,,Despite the rapid change in childrens ecology and the rapid advance of technology research on the impact of digital technologies on childrens communication and language development is still scarce and highly fragmented with no unitary approach across disciplines,3820152.96,3820152.96,NORGES TEKNISK-NATURVITENSKAPELIGE UNIVERSITET NTNU,NO,UNIVERSITY OF EAST ANGLIA-FURHAT ROBOTICS AB-SIA DATORZINIBU CENTRS-THE UNIVERSITY OF MANCHESTER-GEORG-AUGUST-UNIVERSITAT GOTTINGENSTIFTUNG OFFENTLICHEN RECHTS-SPONGE UK LIMITED-UNIVERSITY OF LANCASTER-UNIVERSIDADE DO PORTO-UNIVERSITEIT VAN AMSTERDAM-UNIVERSIDAD DE SEVILLA,UK-SE-LV-DE-PT-NL-ES
208712,751924,ConscriptedVolunteer,CLOSED,H2020-EU.1.3.2.,MSCA-IF-2016,Conscripted Volunteering: An Ethnographic Study of Community Engagement Schemes in the Israeli Military,2017-08-01T00:00:00Z,2019-07-31T00:00:00Z,https://aissr.uva.nl/content/research-groups/moving-matters/moving-matters.html,Militaries increasingly engage their soldiers in activities framed as community engagement or volunteering ranging from facilitating activities for children to delivering food to the needy,165598.8,165598.8,UNIVERSITEIT VAN AMSTERDAM,NL,,
228741,898538,Social Housing,SIGNED,H2020-EU.1.3.2.,MSCA-IF-2019,Weaponizing Social Housing in Medellín and Rio de Janeiro,2020-10-01T00:00:00Z,2023-09-30T00:00:00Z,,State-subsidized housing programs have improved the livelihood of low-income populations in Latin American cities for decades,253052.16,253052.16,UNIVERSITEIT VAN AMSTERDAM,NL,,
227004,853133,Worlds of Lithium,SIGNED,H2020-EU.1.1.,ERC-2019-STG,A multi-sited and transnational study of transitions towards post-fossil fuel societies,2020-02-01T00:00:00Z,2025-01-31T00:00:00Z,,Worlds of Lithium is a multi-sited and transnational study that examines how the strategic replacement of fossil fuels with electric transport powered by lithium-ion batteries is taking place in Chile the largest lithium producer worldwide China the world leader in lithium-ion battery production and Norway likely to become the worlds first zero emission electric vehicle country,1500000,1500000,UNIVERSITEIT VAN AMSTERDAM,NL,,
199996,693289,CoHERE,CLOSED,H2020-EU.3.6.,REFLECTIVE-2-2015,Critical Heritages: performing and representing identities in Europe,2016-04-01T00:00:00Z,2019-03-31T00:00:00Z,http://research.ncl.ac.uk/cohere/,CoHERE explores the ways in which identities in Europe are constructed through heritage representations and performances that connect to ideas of place history tradition and belonging,2499651.75,2499651.75,UNIVERSITY OF NEWCASTLE UPON TYNE,UK,MUZEUM HISTORII ZYDOW POLSKICH POLIN-AARHUS UNIVERSITET-ISTANBUL BILGI UNIVERSITESI-ETHNIKO KAI KAPODISTRIAKO PANEPISTIMIO ATHINON-Copenhagen Institute of Interaction Design-STICHTING NATIONAAL MUSEUM VAN WERELDCULTUREN-HERIOT-WATT UNIVERSITY-EUROPEES NETWERK CULTURELE CENTRA IVZW-ALMA MATER STUDIORUM - UNIVERSITA DI BOLOGNA-LATVIJAS KULTURAS AKADEMIJA-UNIVERSITEIT VAN AMSTERDAM,PL-DK-TR-EL-NL-UK-BE-IT-LV
209582,748463,CONPLEX,SIGNED,H2020-EU.1.3.2.,MSCA-IF-2016,The Constitutional Place of Expertise,2018-09-01T00:00:00Z,2020-08-31T00:00:00Z,,The project explores how constitutional principles can enhance the democratic legitimacy of expert-based decision-making in the European Union (EU),165598.8,165598.8,UNIVERSITEIT VAN AMSTERDAM,NL,,
222460,844285,EpiEcoMod,SIGNED,H2020-EU.1.3.2.,MSCA-IF-2018,Through the eye of a mosquito: theoretical modelling of vector-borne zoonotic pathogens,2020-09-01T00:00:00Z,2022-08-31T00:00:00Z,,The spillover of wildlife diseases into humans is increasing and represents one of the biggest global health challenges we are facing today,187572.48,187572.48,UNIVERSITEIT VAN AMSTERDAM,NL,,
226821,864145,ZETA-FM,SIGNED,H2020-EU.1.1.,ERC-2019-COG,Zeta functions and Fourier-Mukai transforms,2020-09-01T00:00:00Z,2025-08-31T00:00:00Z,,Arithmetic geometry and the study of derived categories of coherent sheaves are two central areas of research in algebraic geometry,2000000,2000000,UNIVERSITEIT VAN AMSTERDAM,NL,,
221876,822625,ADMIGOV,SIGNED,H2020-EU.3.6.1.1.+H2020-EU.3.6.1.2.,MIGRATION-02-2018,Advancing Alternative Migration Governance,2019-02-01T00:00:00Z,2023-01-31T00:00:00Z,http://admigov.eu,ADMIGOV aims to promote an alternative migration governance model,2788870,2788870,UNIVERSITEIT VAN AMSTERDAM,NL,ADDIS ABABA UNIVERSITY-STICHTING NEDERLANDS INSTITUUT VOOR INTERNATIONALE BETREKKINGEN CLINGENDAEL-UNIWERSYTET WROCLAWSKI-American University of Beirut-DANSK FLYGTNINGEHJAELP FORENING-UNIVERSITEIT MAASTRICHT-UNIVERSITE LIBRE DE BRUXELLES-KOC UNIVERSITY-UNIVERSITAT DE BARCELONA-CENTRE D'INFORMACIO I DOCUMENTACIO INTERNACIONALS A BARCELONA-PANEPISTIMIO AIGAIOU-AALBORG UNIVERSITET,ET-NL-PL-LB-DK-BE-TR-ES-EL
198618,647314,Becoming Men,SIGNED,H2020-EU.1.1.,ERC-CoG-2014,Becoming Men: Performing responsible masculinities in contemporary urban Africa,2015-09-01T00:00:00Z,2020-08-31T00:00:00Z,http://www.becoming-men.org/,This anthropological study examines the reconfiguration of masculinities in urban Africa over the last 30 years,1999830,1999830,UNIVERSITEIT VAN AMSTERDAM,NL,,
231066,955956,RAPTOR,SIGNED,H2020-EU.1.3.1.,MSCA-ITN-2020,Real-time Adaptive Particle Therapy of Cancer,2021-03-01T00:00:00Z,2025-02-28T00:00:00Z,,The Real-time Adaptive Particle Therapy Of CanceR (RAPTOR) consortium comprises world-class research institutes non-academic particle therapy (PT) centres and industrial providers of PT equipment offering a platform for intercultural interdisciplinary and intersectoral training of early stage researchers (ESRs) in the field of medical physics with a focus on real-time adaptive PT,3967111.08,3967111.08,PAUL SCHERRER INSTITUT,CH,MEDPHOTON GMBH-MEDIZINISCHE UNIVERSITAET WIEN-AARHUS UNIVERSITET-COSYLAB LABORATORIJ ZA KONTROLNE SISTEME DD-LUDWIG-MAXIMILIANS-UNIVERSITAET MUENCHEN-ACADEMISCH ZIEKENHUIS GRONINGEN-GSI HELMHOLTZZENTRUM FUER SCHWERIONENFORSCHUNG GMBH-POLITECNICO DI MILANO-RAYSEARCH LABORATORIES AB (PUBL)-UNIVERZA V LJUBLJANI-UNIVERSITEIT VAN AMSTERDAM-TECHNISCHE UNIVERSITAET DRESDEN,AT-DK-SI-DE-NL-IT-SE
212968,777682,CANCER,SIGNED,H2020-EU.1.3.3.,MSCA-RISE-2017,Personalised Postoperative Immunotherapy To Improving Cancer Outcome and improving quality of life,2018-03-01T00:00:00Z,2022-02-28T00:00:00Z,,During this RISE project we aim to develop nanoparticle-based encapsulated libraries of different immunotherapeutic biomolecules for treatment after surgery as part of a novel cancer management strategy,2430000,2430000,PERCUROS BV,NL,ACADEMISCH ZIEKENHUIS LEIDEN-MEDRES-MEDICAL RESEARCH GMBH-THE UNIVERSITY OF SHEFFIELD-JENACELL GMBH-TECOBIOSCIENCES GMBH-ASSOCIAZIONE CULTURALE CASTELLI ROMANI GREEN TOUR-UNIVERSITA DEGLI STUDI DI CAMERINO-BOSCHIVA MELCHIORRI SRL-UNIVERSITEIT MAASTRICHT-HELRIK AND LOUW AND PARTNERS COMPANY LTD-AUGEAS ASSOCIAZIONE DI SPORT PROMOZIONE E TURISMO-PROGREDUM GMBH-ASSOCIAZIONE HAND IN HAND-HELRIK AND LOUW COMPANY LTD-ERASMUS UNIVERSITAIR MEDISCH CENTRUM ROTTERDAM-TECHNISCHE UNIVERSITEIT DELFT-UNIVERSITEIT VAN AMSTERDAM-UNIWERSYTET JAGIELLONSKI,NL-DE-UK-IT-PL
212773,759079,POLEMIC,SIGNED,H2020-EU.1.1.,ERC-2017-STG,Politics and Emotions Investigated Comparatively,2018-04-01T00:00:00Z,2023-03-31T00:00:00Z,,Many claim that politicians make more and more extreme emotional appeals than ever before because these appeals win over the emotional citizen,1499664,1499664,UNIVERSITEIT VAN AMSTERDAM,NL,,
202800,702880,EDU-DEM,CLOSED,H2020-EU.1.3.2.,MSCA-IF-2015-EF,Democratization through Education? The role of education in strengthening civil agency and voice in Sub-Saharan Africa. (Case study: Uganda),2016-09-01T00:00:00Z,2019-05-01T00:00:00Z,http://politicsandvoice.com/,EDU-DEM advances our understanding of the role of education in fostering democratization processes in sub-Saharan Africa from the bottom up,165598.8,165598.8,UNIVERSITEIT VAN AMSTERDAM,NL,,
195524,657904,PREF LEARNHEUR,CLOSED,H2020-EU.1.3.2.,MSCA-IF-2014-EF,Learning heuristics in preference elicitation tasks: insights from behavioural computational and neurobiological investigations,2015-05-01T00:00:00Z,2017-04-30T00:00:00Z,https://sites.google.com/site/maellebreton/home,Although decision theory assumes that when making a choice individuals attribute values to available options compare those values and select the option with the highest the succession of choices faced during classical preference elicitation tasks might trigger the emergence of additional heuristics implemented to perform those tasks in a fast yet adaptive manner,165598.8,165598.8,UNIVERSITEIT VAN AMSTERDAM,NL,,
224117,857996,ERC VP CSA,CLOSED,H2020-EU.1.1.,IBA-ERC-VPRES-SUP-19,Support to the Vice-Presidents of the ERC Scientific Council 2019,2019-01-01T00:00:00Z,2019-12-31T00:00:00Z,https://www.uva.nl/,The European Research Council (ERC) provides a competitive platform for investigator-driven frontier research at the European level,281597.5,281597.5,UNIVERSITEIT VAN AMSTERDAM,NL,EUROPEAN MOLECULAR BIOLOGY LABORATORY-UNIVERSITA DEGLI STUDI DI PADOVA,DE-IT
208786,714977,PEP,SIGNED,H2020-EU.1.1.,ERC-2016-STG,An Empirical Foundation for Understanding Positive Emotions,2017-09-01T00:00:00Z,2022-08-31T00:00:00Z,,Positive emotions are of great importance for our physical and mental health and for our social relationships,1500000,1500000,UNIVERSITEIT VAN AMSTERDAM,NL,,
228519,865898,BuildingTomorrow,SIGNED,H2020-EU.1.1.,ERC-2019-COG,Building a Better Tomorrow: Development Knowledge and Practice in Central Asia and Beyond 1970-2017,2020-05-01T00:00:00Z,2025-04-30T00:00:00Z,,The landscape of post-Soviet Central Asia (Tajikistan Uzbekistan Kyrygzstan Kazakhstan Turkmenistan) is littered with the physical remnants of Soviet development both positive –health clinics and schools – and negative - decaying factories polluted soil and dried out rivers,1997605,1997605,UNIVERSITEIT VAN AMSTERDAM,NL,,
215736,799493,EMO - FIT,TERMINATED,H2020-EU.1.3.2.,MSCA-IF-2017,Emotional Fit in Intercultural Interactions: Studying mimicry and emotional grounding as micro-processes of (intercultural) belonging.,2018-10-01T00:00:00Z,2020-09-30T00:00:00Z,,Migration is often associated with lower well-being among minorities and with lower social cohesion in the host-society,177598.8,177598.8,UNIVERSITEIT VAN AMSTERDAM,NL,,
216277,794254,HELPHERGEN,SIGNED,H2020-EU.1.3.2.,MSCA-IF-2017,THE GENETIC BASIS OF MATING BEHAVIOR: PHEROMONE COMMUNICATION IN NOCTUID MOTHS,2018-10-01T00:00:00Z,2020-12-13T00:00:00Z,,The genetic architecture of behavior is a major topic in biology but remains poorly understood,177598.8,177598.8,UNIVERSITEIT VAN AMSTERDAM,NL,,
197534,671564,ComPat,CLOSED,H2020-EU.1.2.2.,FETHPC-1-2014,Computing Patterns for High Performance Multiscale Computing,2015-10-01T00:00:00Z,2018-09-30T00:00:00Z,http://www.compatproject.eu,Multiscale phenomena are ubiquitous and they are the key to understanding the complexity of our world,4122864.36,3942885,UNIVERSITEIT VAN AMSTERDAM,NL,UNIVERSITEIT LEIDEN-ITMO UNIVERSITY-CBK SCI CON LIMITED-INSTYTUT CHEMII BIOORGANICZNEJ POLSKIEJ AKADEMII NAUK-BAYERISCHE AKADEMIE DER WISSENSCHAFTEN-UNITED KINGDOM RESEARCH AND INNOVATION-ARM LIMITED-BRUNEL UNIVERSITY LONDON-MAX-PLANCK-GESELLSCHAFT ZUR FORDERUNG DER WISSENSCHAFTEN EV-UNIVERSITY COLLEGE LONDON-ALLINEA SOFTWARE LIMITED,NL-RU-UK-PL-DE
210267,743032,DYNAMINT,SIGNED,H2020-EU.1.1.,ERC-2016-ADG,Dynamics of Probed Pulsed Quenched and Driven Integrable Quantum Systems,2017-09-01T00:00:00Z,2022-08-31T00:00:00Z,,This proposal intends to develop and apply a new-generation theoretical toolbox for understanding the rich dynamics of strongly-interacting many-body quantum sytems subjected to destabilizing manipulations bringing them very far from equilibrium,2444446,2444446,UNIVERSITEIT VAN AMSTERDAM,NL,,
207866,715656,GenGeoHol,SIGNED,H2020-EU.1.1.,ERC-2016-STG,Non AdS holography and generalized geometric structures,2017-09-01T00:00:00Z,2022-08-31T00:00:00Z,,Holography is by now a fundamental tool in the understanding of both strongly coupled conformal field theories (CFTs) and quantum theories of gravity,1300775,1300775,UNIVERSITEIT VAN AMSTERDAM,NL,,
198305,675743,ISPIC,CLOSED,H2020-EU.1.3.1.,MSCA-ITN-2015-ETN,Image-Guided Surgery (IGS) and Personalised Postoperative Immunotherapy To Improving Cancer Outcome,2016-01-01T00:00:00Z,2019-12-31T00:00:00Z,http://www.ispic.eu/,The basic concept of our proposal is to develop nanoparticle-based encapsulated libraries of different immunotherapeutic biomolecules for treatment after surgery as part of a novel cancer management strategy,3922309.44,3922309.44,PERCUROS BV,NL,ACADEMISCH ZIEKENHUIS LEIDEN-MEDRES-MEDICAL RESEARCH GMBH-THE UNIVERSITY OF SHEFFIELD-JENACELL GMBH-TECOBIOSCIENCES GMBH-UNIVERSITA DEGLI STUDI DI CAMERINO-UNIVERSITEIT MAASTRICHT-ECOLE POLYTECHNIQUE FEDERALE DE LAUSANNE-ERASMUS UNIVERSITAIR MEDISCH CENTRUM ROTTERDAM-HELSE BERGEN HF*HAUKELAND UNIVERSITY HOSPITAL-UNIVERSITETET I BERGEN-TECHNISCHE UNIVERSITEIT DELFT-UNIVERSITEIT VAN AMSTERDAM,NL-DE-UK-IT-CH-NO
198443,647316,EUROPINIONS,SIGNED,H2020-EU.1.1.,ERC-CoG-2014,Causes and consequences of change in public opinion about Europe,2015-09-01T00:00:00Z,2020-08-31T00:00:00Z,https://www.polcomm.org/research/erc-europinions/,Causes and consequences of change in public opinion about Europe Public opinion towards European integration and the EU is divided especially in the wake of the economic crisis,2000000,2000000,UNIVERSITEIT VAN AMSTERDAM,NL,,
201030,702402,ORCA,CLOSED,H2020-EU.1.3.2.,MSCA-IF-2015-EF,Oscillatory long-Range Coherence in Attention,2016-08-01T00:00:00Z,2018-11-20T00:00:00Z,https://www.heleenslagter.com/,Attention -the ability to focus selectively on task relevant information and resist distraction- plays a critical role in many everyday life situations such as in school or while driving,177598.8,177598.8,UNIVERSITEIT VAN AMSTERDAM,NL,,
212798,759681,BLOCKCHAINSOCIETY,SIGNED,H2020-EU.1.1.,ERC-2017-STG,The Disrupted Society: mapping the societal effects of blockchain technology diffusion,2018-01-01T00:00:00Z,2022-12-31T00:00:00Z,,Recent advances in cryptography yielded the blockchain technology which enables a radically new and decentralized method to maintain authoritative records without the need of trusted intermediaries,1499631,1499631,UNIVERSITEIT VAN AMSTERDAM,NL,,
209739,726225,UVdynamicsProtection,SIGNED,H2020-EU.1.1.,ERC-2016-COG,Aligning pigmentation and repair: a holistic approach for UV protection dynamics,2017-04-01T00:00:00Z,2022-03-31T00:00:00Z,,The human body takes different measures in order to protect itself against the results of UV exposure and its accompanied hazards such as skin cancer,1971875,1971875,TEL AVIV UNIVERSITY,IL,,
213094,779802,ITHACA,CLOSED,H2020-EU.1.1.,ERC-2017-PoC,Immuno-targeting of human AML quiescent cells by a novel phage display approach.,2018-01-01T00:00:00Z,2019-06-30T00:00:00Z,,One main objective of our ERC Advanced Grant project (InMec No 341131) was to determine how cancer stem cells (CSCs) contribute to tumour growth and the relative impact of quiescent versus proliferative CSCs,150000,150000,ISTITUTO EUROPEO DI ONCOLOGIA SRL,IT,,
205337,702642,HOXA9 degradome,SIGNED,H2020-EU.1.3.2.,MSCA-IF-2015-GF,Deciphering the machinery involved in stability of the transcription factor HOXA9.,2016-11-07T00:00:00Z,2019-11-06T00:00:00Z,https://ebertlab.dana-farber.org/,Transcription factors are often mutated or aberrantly expressed in cancer and drive carcinogenesis,239860.8,239860.8,DEUTSCHES KREBSFORSCHUNGSZENTRUM HEIDELBERG,DE,,
