rcn,id,acronym,status,programme,topics,title,startDate,endDate,projectUrl,objective,totalCost,ecMaxContribution,coordinator,coordinatorCountry,participants,participantCountries
226153,874769,HCA Organoid,SIGNED,H2020-EU.3.1.1.,SC1-BHC-31-2019,HCA|Organoid: Pilot action to establish a multi-tissue human organoid platform within the Human Cell Atlas as a booster of future disease-centric mechanistic and translational research,2020-01-01T00:00:00Z,2022-03-31T00:00:00Z,,Excellence: The Human Cell Atlas (HCA) is descriptive by definition as it seeks to map all cells in the human body,4998687.5,4998687.5,CEMM - FORSCHUNGSZENTRUM FUER MOLEKULARE MEDIZIN GMBH,AT,STICHTING HUBRECHT ORGANOID TECHNOLOGY-EUROPEAN MOLECULAR BIOLOGY LABORATORY-FRIEDRICH MIESCHER INSTITUTE FOR BIOMEDICAL RESEARCH FONDATION-EURICE EUROPEAN RESEARCH AND PROJECT OFFICE GMBH-DEUTSCHES KREBSFORSCHUNGSZENTRUM HEIDELBERG-PRINSES MAXIMA CENTRUM VOOR KINDERONCOLOGIE BV-INSTITUT FUER MOLEKULARE BIOTECHNOLOGIE GMBH,NL-DE-CH-AT
210568,742883,BARCODED-CELLTRACING,SIGNED,H2020-EU.1.1.,ERC-2016-ADG,Endogenous barcoding for in vivo fate mapping of lineage development in the blood and immune system,2017-07-01T00:00:00Z,2022-06-30T00:00:00Z,,The immune system is a complex ensemble of diverse lineages,2500000,2500000,DEUTSCHES KREBSFORSCHUNGSZENTRUM HEIDELBERG,DE,,
214709,772464,THIRST,SIGNED,H2020-EU.1.1.,ERC-2017-COG,Third Strategy in Tissue Engineering – Functional microfabricated multicellular spheroid carriers for tissue engineering and regeneration,2018-05-01T00:00:00Z,2023-04-30T00:00:00Z,,The field of tissue engineering (TE) pursues a noble goal driven by the urgent need for tissue and organ repair,1999962.5,1999962.5,TECHNISCHE UNIVERSITAET WIEN,AT,LUDWIG BOLTZMANN GESELLSCHAFT OSTERREICHISCHE VEREINIGUNG ZUR FORDERUNG DER WISSENSCHAFTLICHEN FORSCHUNG,AT
200690,677209,EVI1inCancer,SIGNED,H2020-EU.1.1.,ERC-StG-2015,Overcoming the epigenetic and therapeutic barrier of EVI1-overexpressing cancers,2016-06-01T00:00:00Z,2021-05-31T00:00:00Z,,Deregulation of the EVI1 oncogene is a key transforming event in the development of many malignancies most prominently very high-risk acute myeloid leukemia (AML) ovarian colon breast non-small cell lung cancer and soft-tissue sarcoma,1499094,1499094,DEUTSCHES KREBSFORSCHUNGSZENTRUM HEIDELBERG,DE,,
210982,742039,Redox Relays,SIGNED,H2020-EU.1.1.,ERC-2016-ADG,Detecting understanding and exploiting intracellular redox signaling relays,2017-10-01T00:00:00Z,2022-09-30T00:00:00Z,,Redox signaling is a process by which endogenous oxidants derived from metabolism reversibly modify particular thiols on particular proteins to change their functional behavior in an adaptive manner,2006250,2006250,DEUTSCHES KREBSFORSCHUNGSZENTRUM HEIDELBERG,DE,,
216508,787181,AngioMature,SIGNED,H2020-EU.1.1.,ERC-2017-ADG,Mechanisms of vascular maturation and quiescence during development homeostasis and aging,2018-08-01T00:00:00Z,2023-07-31T00:00:00Z,,Angiogenesis research has focused on the sprouting of new capillaries,2338918,2338918,RUPRECHT-KARLS-UNIVERSITAET HEIDELBERG,DE,DEUTSCHES KREBSFORSCHUNGSZENTRUM HEIDELBERG,DE
220410,804710,SafeFate,SIGNED,H2020-EU.1.1.,ERC-2018-STG,Safeguarding Cell Fate by Terminal Repression during Development and Disease,2019-02-01T00:00:00Z,2024-01-31T00:00:00Z,,Cell identity and function requires both induction of desired genes and repression of unwanted programs,1761489,1761489,DEUTSCHES KREBSFORSCHUNGSZENTRUM HEIDELBERG,DE,,
208462,724286,C18Signaling,SIGNED,H2020-EU.1.1.,ERC-2016-COG,Regulation of Cellular Growth and Metabolism by C18:0,2017-03-01T00:00:00Z,2022-02-28T00:00:00Z,https://www.dkfz.de/en/signal-transduction-cancer/pages/publications_snapshots.html,My lab studies how cells regulate their growth and metabolism during normal development and in disease,2000000,2000000,DEUTSCHES KREBSFORSCHUNGSZENTRUM HEIDELBERG,DE,,
195919,660259,OPTOFRAX,SIGNED,H2020-EU.1.3.2.,MSCA-IF-2014-EF,Optopharmacological brain mapping of autism mouse models,2015-07-01T00:00:00Z,2017-06-30T00:00:00Z,http://ibecbarcelona.eu/nanoprobes,Manipulation of neurons with light-regulated proteins and drugs has opened unprecedented possibilities for phototherapies for neurological diseases,170121.6,170121.6,FUNDACIO INSTITUT DE BIOENGINYERIA DE CATALUNYA,ES,,
212804,759579,DualRP,SIGNED,H2020-EU.1.1.,ERC-2017-STG,Exploring cell interactions in the tumor microenvironment with dual ribosome profiling,2018-06-01T00:00:00Z,2023-05-31T00:00:00Z,,Cancers develop in very heterogeneous tissue environments,1499375,1499375,DEUTSCHES KREBSFORSCHUNGSZENTRUM HEIDELBERG,DE,,
213830,790423,REMATCH,CLOSED,H2020-EU.1.1.,ERC-2017-PoC,Image-based analysis for drug discovery and repurposing,2018-08-01T00:00:00Z,2020-01-31T00:00:00Z,,Drug discovery and development has become a lengthy and resource-intensive process which is characterized by high attrition rates of candidate molecules,149500,149500,DEUTSCHES KREBSFORSCHUNGSZENTRUM HEIDELBERG,DE,,
210989,742422,HBEAM,SIGNED,H2020-EU.1.1.,ERC-2016-ADG,Probing chemical dynamics at surfaces with ultrafast atom pulses,2017-10-01T00:00:00Z,2022-09-30T00:00:00Z,,Ultra-short light pulses have become invaluable in time-resolved studies in chemistry and physics,2499356.27,2499356.27,MAX-PLANCK-GESELLSCHAFT ZUR FORDERUNG DER WISSENSCHAFTEN EV,DE,,
208836,739697,FEMTOCOLORS,CLOSED,H2020-EU.2.3.2.2.,INNOSUP-02-2016,Femtosecond Temporally Coherent Supercontinuum Fiber Laser for Multi-Photon Microscopy,2017-09-29T00:00:00Z,2018-09-28T00:00:00Z,http://www.fyla.com/company/,The mail goal of this proposal is the recruitment of a postdoctoral researcher from other countries to explore an innovation business idea the development of a Femtosecond (Fs) Temporally Coherent Supercontinuum (SC) Fiber Laser for Multi-Photon Microscopy (MPM),73750,73750,FYLA LASER SL,ES,,
198229,670557,MIMAS,SIGNED,H2020-EU.1.1.,ERC-ADG-2014,Multi-dimensional interferometric amplification of ultrashort laser pulses,2015-09-01T00:00:00Z,2020-08-31T00:00:00Z,http://www.iap.uni-jena.de/MIMAS.html,Ultrafast lasers which allow the concentration of light in space and time have been instrumental in revolutionizing industrial production technologies medical applications and cutting-edge fundamental research,2373750,2373750,FRIEDRICH-SCHILLER-UNIVERSITAT JENA,DE,,
215640,798402,RydSpin,CLOSED,H2020-EU.1.3.2.,MSCA-IF-2017,Nonequilibrium many-body spin dynamics in strongly interacting Rydberg systems,2018-07-01T00:00:00Z,2019-06-30T00:00:00Z,https://www.physi.uni-heidelberg.de/Forschung/QD/,There is a currently growing interest in utilizing dipolar interacting Rydberg spin systems to simulate behavior of electron spins in magnetic materials,79730.4,79730.4,RUPRECHT-KARLS-UNIVERSITAET HEIDELBERG,DE,,
195750,659213,LIVING LASERS,CLOSED,H2020-EU.1.3.2.,MSCA-IF-2014-EF,Living cell lasers: intracellular lasing induced by natural and polymeric microscopic resonators,2015-08-01T00:00:00Z,2017-07-31T00:00:00Z,http://gatherlab.wp.st-andrews.ac.uk/people/,Can a living cell be turned into a laser? By aiming to coalesce biological cells with laser light the most versatile tool that modern photonics has developed LIVING LASERS explores entirely new ways to develop fully biocompatible lasers,195454.8,195454.8,THE UNIVERSITY COURT OF THE UNIVERSITY OF ST ANDREWS,UK,,
209788,748752,Fluidblasto,CLOSED,H2020-EU.1.3.2.,MSCA-IF-2016,Luminal pressure: a sculptor for mouse blastocyst self-organisation,2018-09-01T00:00:00Z,2020-08-31T00:00:00Z,,An important morphogenetic event of mammalian embryogenesis is the formation of a blastocyst with a fluid-filled cavity blastocoel and the establishment of three cell types essential for implantation,171460.8,171460.8,EUROPEAN MOLECULAR BIOLOGY LABORATORY,DE,,
197899,660508,MIRIPSHE,CLOSED,H2020-EU.1.3.2.,MSCA-IF-2014-EF,MID-IR Integrated Photonic Sensor for Health and Environment,2016-01-01T00:00:00Z,2017-12-31T00:00:00Z,https://www.openaire.eu/search/project,MID-IR Integrated Photonic Sensor for Health and Environment (MIRIPSHE) address the growing demand for a CMOS compatible Mid-infrared (MIR) wave band photonic sensor,195454.8,195454.8,UNIVERSITY OF LEEDS,UK,,
230809,948525,HILTRAC,SIGNED,H2020-EU.1.1.,ERC-2020-STG,Highly Instrumented Low Temperature Reaction Chamber,2021-02-01T00:00:00Z,2026-01-31T00:00:00Z,,In this project I will build optimize and apply a Highly Instrumented Low Temperature Reaction Chamber (HILTRAC) to study organosulfur chemical reactions,2493790,2493790,UNIVERSITY OF LEEDS,UK,,
214108,792595,NaTOS,CLOSED,H2020-EU.1.3.2.,MSCA-IF-2017,Nanoscale Thermo Optical Sensing,2018-03-01T00:00:00Z,2020-02-29T00:00:00Z,https://www.single-molecule.nl/research/optoplasmonic-biosensors/,NaTOS: Nanoscale Thermo Optical Sensing is the concept of a new truly label free bio-sensor device capable of monitoring transient molecular interactions,165598.8,165598.8,UNIVERSITEIT LEIDEN,NL,,
207863,715452,MAGNETIC-SPEED-LIMIT,SIGNED,H2020-EU.1.1.,ERC-2016-STG,Understanding the speed limits of magnetism,2017-02-01T00:00:00Z,2022-01-31T00:00:00Z,http://magnetic-speed-limit.eu,While the origin of magnetic order in condensed matter is in the exchange and spin-orbit interactions with time scales in the subpicosecond ranges it has been long believed that magnetism could only be manipulated at nanosecond rates exploiting dipolar interactions with external magnetic fields,1967755,1967755,STOCKHOLMS UNIVERSITET,SE,UNIVERSITA CA' FOSCARI VENEZIA,IT
194791,652474,PICOMB,CLOSED,H2020-EU.2.1.1.+H2020-EU.2.3.1.,ICT-37-2014-1,Photonic Integrated Comb Source: An Economic Feasibility Study,2014-10-01T00:00:00Z,2015-03-31T00:00:00Z,http://www.pilotphotonics.com,Optical telecommunication networks are being put under huge strain by the rise in mobile video video-on-demand and other bandwidth intensive services,71429,50000,PILOT PHOTONICS LTD,IE,,
201307,705249,RICC,CLOSED,H2020-EU.1.3.2.,MSCA-IF-2015-EF,The Application of Advanced Raman Spectroscopies to the Quantitative Analysis of Industrial Chromatography Columns,2016-10-01T00:00:00Z,2018-09-30T00:00:00Z,http://www.nuigalway.ie/nanoscale/,Dr,175866,175866,NATIONAL UNIVERSITY OF IRELAND GALWAY,IE,,
194485,647077,NewSpindleForce,SIGNED,H2020-EU.1.1.,ERC-CoG-2014,A new class of microtubules in the spindle exerting forces on kinetochores,2015-04-01T00:00:00Z,2020-03-31T00:00:00Z,http://tolic.irb.hr/erc-project,At the onset of division the cell forms a spindle a micro-machine made of microtubules which divide the chromosomes by pulling on kinetochores protein complexes on the chromosome,2150000,2150000,RUDER BOSKOVIC INSTITUTE,HR,,
193311,634886,GLORIA,SIGNED,H2020-EU.3.1.3.,PHC-17-2014,Comparing the effectiveness and safety of additional low-dose glucocorticoid in treatment strategies for elderly patients with rheumatoid arthritis,2015-09-01T00:00:00Z,2021-08-31T00:00:00Z,http://www.gloriatrial.org,GLORIA aims to prove that the addition of chronic low dose glucocorticoids (GC) to current antirheumatic therapy is highly cost-effective and safe in elderly patients with rheumatoid arthritis (RA),5855219.03,5855219.03,STICHTING VUMC,NL,STICHTING VU-DEBRECENI EGYETEM-NARODNY USTAV REUMATICKYCH CHOROB-NURCH NIRD NATIONAL INSTITUTE OF RHEUMATIC DISEASES-BEYONDEVICES LDA-STICHTING TOOLS-CENTRO HOSPITALAR E UNIVERSITARIO DE COIMBRA E.P.E.-LINICAL NETHERLANDS B.V.-CHARITE - UNIVERSITAETSMEDIZIN BERLIN-UNIVERSITA DEGLI STUDI DI GENOVA-BLUEPHARMA - INDUSTRIA FARMACEUTICASA-UNIVERSITATEA DE MEDICINA SI FARMACIE CAROL DAVILA DIN BUCURESTI-CR2O BV,NL-HU-SK-PT-DE-IT-RO
206150,720274,GLAUrious,SIGNED,H2020-EU.3.+H2020-EU.2.,FTIPilot-1-2015,External Automatic Glaucoma Laser (EAGLE) for the first-line glaucoma treatment: Commercial prototype development and validation,2016-09-01T00:00:00Z,2020-02-29T00:00:00Z,http://www.glaurious.eu,The GLAUrious project is promoting the novel External Automatic Glaucoma Laser (EAGLE) device with the goal of providing accessible first-line treatment for glaucoma,4036138.25,2480275,THE QUEEN'S UNIVERSITY OF BELFAST,UK,BELKIN LASER LTD-MAZO VSEVOLOD-MEDICAL CONSULTING AND INVESTMENT-UNIVERSITA DEGLI STUDI DI GENOVA,IL-DE-BE-IT
193333,635491,DexROV,CLOSED,H2020-EU.3.2.,BG-06-2014,Dexterous ROV: effective dexterous ROV operations in presence of communication latencies.,2015-03-01T00:00:00Z,2018-08-31T00:00:00Z,http://www.dexrov.com/,Underwater operations (eg oil industry) are demanding and costly activities for which ROV based setups are often deployed in addition to deep divers – contributing to operations risks and costs cutting,5336006.25,4631182.5,SPACE APPLICATIONS SERVICES NV,BE,GRAAL TECH SRL-JACOBS UNIVERSITY BREMEN GGMBH-FONDATION DE L'INSTITUT DE RECHERCHE IDIAP-UNIVERSITA DEGLI STUDI DI GENOVA-COMPAGNIE MARITIME D EXPERTISES SA-EJR-QUARTZ BV,IT-DE-CH-FR-NL
230275,952369,MILIEU,SIGNED,H2020-EU.4.b.,WIDESPREAD-05-2020,Women Disability and Inclusion – Scientific Excellence in Bulgaria,2021-01-01T00:00:00Z,2023-12-31T00:00:00Z,,The objective of MILIEU (woMen dIsabiLity and Inclusion – Scientific Excellence in BUlgaria) is to create a networking collaboration between the Institute for the Study of the Societies and Knowledge of the Bulgarian Academy of Sciences (ISSK-BAS) and two high renowned Universities: Universidad Complutense de Madrid (Spain) and Università degli Studi di Genova(Italy) with the final aim of increasing ISSK-BAS scientific excellence and visibility research innovation capacity and of enabling frontier research at the crossroad of studies on women disability and inclusion,895625,895625,INSTITUTE OF PHILOSOPHY AND SOCIOLOGY,BG,UNIVERSIDAD COMPLUTENSE DE MADRID-UNIVERSITA DEGLI STUDI DI GENOVA,ES-IT
210302,745855,OCTARRAY,CLOSED,H2020-EU.3.3.2.,LCE-15-2016,Scaling up to the Normandie Hydro Open-Centre Tidal Turbine Pilot Array,2017-09-01T00:00:00Z,2020-08-31T00:00:00Z,http://www.emec.org.uk/,OCTARRAY is part of an an ambitious 3-year tidal array demonstration programme located in North Western French territorial waters of the Raz Blanchard a 15 km strait situated between Cap de la Hague and Alderney Island,1.1789474875E8,15000000,THE EUROPEAN MARINE ENERGY CENTRE LIMITED,UK,OPENHYDRO TECHNOLOGY FRANCE-CRIST OFFSHORE SPOLKA Z ORGANICZONA ODPOWIEDZIALNOSCIA-DANMARKS TEKNISKE UNIVERSITET-NAVAL ENERGIES,FR-PL-DK
215228,794075,REPTOL,SIGNED,H2020-EU.1.3.2.,MSCA-IF-2017,Pre-leukemic B cell repertoire alterations in patients with familial chronic lymphocytic leukemia: looking for evidence of a genetically-inherited defect in tolerance induction,2019-04-01T00:00:00Z,2021-03-31T00:00:00Z,,B-cell chronic lymphocytic leukemia (CLL) is a frequent B-cell leukemia of unknown etiology with the strongest familial inheritance among lymphoproliferative disorder,180277.2,180277.2,UNIVERSITA DEGLI STUDI DI GENOVA,IT,,
199137,688269,TELMI,SIGNED,H2020-EU.2.1.1.,ICT-20-2015,Technology Enhanced Learning of Musical Instrument Performance,2016-02-01T00:00:00Z,2019-01-31T00:00:00Z,http://telmi.upf.edu/,Learning to play a musical instrument is mostly based on the master-apprentice model in which the students interaction and socialization is often restricted to short and punctual contact with the teacher followed by long periods of self-study resulting in high abandonment rates,2617425,2617425,UNIVERSIDAD POMPEU FABRA,ES,ROYAL COLLEGE OF MUSIC-SAICO INTELLIGENCE S.L.-UNIVERSITA DEGLI STUDI DI GENOVA-HIGHSKILLZ LIMITED,UK-ES-IT
211465,770064,DocksTheFuture,SIGNED,H2020-EU.3.4.,MG-7-3-2017,Developing the methodology for a coordinated approach to the clustering monitoring and evaluation of results of actions under the Ports of the Future topic,2018-01-01T00:00:00Z,2020-11-30T00:00:00Z,https://www.docksthefuture.eu/,The EU maritime transport constitutes a crucial link in the global logistic chains and plays a leading role in international freight transport,1275562.5,1275562.5,CIRCLE SPA,IT,MAGELLAN-ASSOCIACAO PARA A REPRESENTACAO DOS INTERESSES PORTUGUESES NO EXTERIOR-INSTITUT FUR SEEVERKEHRSWIRTSCHAFT UND LOGISTIK-PORTS AND TERMINALS CVBA-UNIVERSITA DEGLI STUDI DI GENOVA,PT-DE-BE-IT
213517,773012,NEUROFISH,SIGNED,H2020-EU.1.1.,ERC-2017-COG,Whole-brain circuits controlling visuomotor behavior,2018-02-01T00:00:00Z,2023-01-31T00:00:00Z,,Understanding how our brains extract relevant features of sensory input to select and guide appropriate actions is a fundamental goal of neuroscience,1694063,1694063,FUNDACAO D. ANNA SOMMER CHAMPALIMAUD E DR. CARLOS MONTEZ CHAMPALIMAUD,PT,,
199630,639888,REGENETHER,SIGNED,H2020-EU.1.1.,ERC-StG-2014,Modeling and treating retinal degenerative disease,2015-12-01T00:00:00Z,2020-11-30T00:00:00Z,,Gene therapy using adeno-associated viral (AAV) vectors has shown early promise in clinical trials,1300000,1300000,SORBONNE UNIVERSITE,FR,,
196514,673562,RETOXY,CLOSED,H2020-EU.3.1.3.,PHC-12-2014-1,Clinical validation of retinal oximetry as a biomarker,2015-05-01T00:00:00Z,2015-10-31T00:00:00Z,http://www.oxymap.com/,Disturbance in oxygenation of the retina of the eye is believed to be involved in many sight-threatening diseases such as diabetic retinopathy glaucoma and age-related macular degeneration,71429,50000,OXYMAP EHF,IS,,
217898,827213,Primavera,SIGNED,H2020-EU.3.+H2020-EU.2.3.+H2020-EU.2.1.,EIC-SMEInst-2018-2020,Primavera: immunobiotics for treating early stage Age-related Macular Degeneration (AMD),2018-08-01T00:00:00Z,2019-01-31T00:00:00Z,http://www.nutripharma.hu/nutripharma/primavera-project/,Age-related Macular Degeneration (AMD) is a chronic progressive sight-threatening disease caused by the damage of the macula the small central area of the retina,71429,50000,NUTRIPHARMA HUNGARIA TAP ES GYOGYSZER ELOALLITO KFT,HU,,
208952,748716,ColourFish,CLOSED,H2020-EU.1.3.2.,MSCA-IF-2016,Zebrafish colour vision: a functional approach to studying outer retinal wiring strategies,2017-05-01T00:00:00Z,2019-04-30T00:00:00Z,https://badenlab.org,Colour vision is critical animals to navigate their environment,195454.8,195454.8,THE UNIVERSITY OF SUSSEX,UK,,
197118,664557,LignoSilva,CLOSED,H2020-EU.4.a.,WIDESPREAD-1-2014,Centre of Excellence of Forest-based Industry,2015-06-01T00:00:00Z,2016-05-31T00:00:00Z,http://lignosilva.nlcsk.org/,The general objectives of the project is to create the Centre of excellence (LignoSilva) in the field of a forestry wood-processing and a pulp-paper complex involving two major organizations the National Forest Centre in Zvolen and Pulp and Paper Research Institute in Bratislava in cooperation with the European Forest Institute as a leading research organisations from high performance countries of the EU,467438,467438,NARODNE LESNICKE CENTRUM,SK,EUROPEAN FOREST INSTITUTE-VYSKUMNY USTAV PAPIERA A CELULOZY AS,FI-SK
221169,856327,MAKERSITE,CLOSED,H2020-EU.3.+H2020-EU.2.3.+H2020-EU.2.1.,EIC-SMEInst-2018-2020,Makersite - The Product Intelligence Platform,2019-03-01T00:00:00Z,2019-06-30T00:00:00Z,http://makersite.de,Makersite helps to solve the Compliance – Cost – Sustainability problem for products and their supply chains in a single integrated platform,71429,50000,MAKERSITE GMBH,DE,,
213260,790142,BioAhead,SIGNED,H2020-EU.2.1.1.+H2020-EU.2.3.1.,SMEInst-01-2016-2017,BioAhead – an innovative optimization algorithm for amino acid chain analytics,2017-12-01T00:00:00Z,2018-05-31T00:00:00Z,http://www.bioahead.de,Globosoft GmbH aims to optimize the drug development process of drug manufacturers enabling faster and more efficient development of drugs in Europe and worldwide,71429,50000,GLOBOSOFT GMBH,DE,,
195686,658917,MANGANOXI,CLOSED,H2020-EU.1.3.2.,MSCA-IF-2014-EF,The development of manganese-based alkene epoxidation cis-dihydroxylation and alkane C-H oxidation catalysts,2015-09-01T00:00:00Z,2017-08-31T00:00:00Z,http://www.sbcs.qmul.ac.uk/staff/mikewatkinson.html,The catalytic oxidation of alkenes to give epoxides and syn-diols as well as the hydroxylation of C-H bonds in alkanes using environmentally benign reagents and conditions remains an area of significant challenge in contemporary synthetic chemistry and highly effective catalytic systems remains elusive,195454.8,195454.8,QUEEN MARY UNIVERSITY OF LONDON,UK,,
215551,797533,REGinTRAN,SIGNED,H2020-EU.1.3.2.,MSCA-IF-2017,Advanced manufacturing and the transition of regional economies: institutions social regulation and development in Apulia and Lower Silesia,2018-11-01T00:00:00Z,2021-04-30T00:00:00Z,,At a time of technological transition REGinTRAN aims to understand under which conditions advanced manufacturing might turn out to be a viable driver for sustaining the development of regions suffering from structural disadvantages,180277.2,180277.2,UNIVERSITA DEGLI STUDI DI FIRENZE,IT,,
206134,714023,CrackEpitranscriptom,SIGNED,H2020-EU.1.1.,ERC-2016-STG,Cracking the epitranscriptome,2016-11-01T00:00:00Z,2021-10-31T00:00:00Z,,Over 100 types of distinct modifications are catalyzed on RNA molecules post-transcriptionally,1402666,1402666,WEIZMANN INSTITUTE OF SCIENCE,IL,,
210902,715069,FINDER,SIGNED,H2020-EU.1.1.,ERC-2016-STG,Fossil Fingerprinting and Identification of New Denisovan remains from Pleistocene Asia,2017-06-01T00:00:00Z,2022-05-31T00:00:00Z,http://www.finderc.org,Scientific analyses of ancient biomolecules (proteins DNA hard tissues) have transformed our knowledge of archaic hominins present in Eurasia prior to the expansion of modern humans from Africa,1999292,1999292,MAX-PLANCK-GESELLSCHAFT ZUR FORDERUNG DER WISSENSCHAFTEN EV,DE,,
210477,725519,BuddhistRoad,SIGNED,H2020-EU.1.1.,ERC-2016-COG,Dynamics in Buddhist Networks in Eastern Central Asia 6th-14th Centuries,2017-08-01T00:00:00Z,2022-07-31T00:00:00Z,,The objective of this proposal is to create a new framework to enable understanding of the complexities in the dynamics of cultural encounter and religious transfer in pre-modern Eastern Central Asia—the vast area extending from the Taklamakan desert to Northeast China,1998717,1998717,RUHR-UNIVERSITAET BOCHUM,DE,,
223361,842070,VIAMEDIAITALICA,SIGNED,H2020-EU.1.3.2.,MSCA-IF-2018,The Scholar the Jurist the Priest: Moderation on the Italian Peninsula 1700-1750,2020-01-13T00:00:00Z,2022-04-15T00:00:00Z,,As Europe enters the third decade of the 21st Century moderation is a concept in crisis,224933.76,224933.76,UNIVERSITY OF NEWCASTLE UPON TYNE,UK,,
215014,790531,Host Sweet Home,CLOSED,H2020-EU.1.3.2.,MSCA-IF-2017,Unravelling the mechanisms that allow endosymbionts to make themselves at home within hosts from transfer to transit.,2018-10-01T00:00:00Z,2021-10-31T00:00:00Z,http://www.anneduplouy.net,Endosymbiotic bacteria are usually not infectious they have been thought to exclusively transfer vertically from the host mother to her offspring,185857.2,185857.2,LUNDS UNIVERSITET,SE,,
202774,702296,MIGROPOLIS,CLOSED,H2020-EU.1.3.2.,MSCA-IF-2015-EF,Renaissance Migropolis: Mobility Migration and the Politics of Reception in Venice (ca. 1450-1650),2016-10-01T00:00:00Z,2019-02-17T00:00:00Z,https://www.eui.eu/DepartmentsAndCentres/HistoryAndCivilization/People/Fellows/Profiles/Salzberg,This project aims to provide an invaluable new perspective on the motives practices and consequences of migration in European history by examining one of the most dynamic and cosmopolitan of past urban societies: Renaissance Venice (ca,172477.2,172477.2,EUROPEAN UNIVERSITY INSTITUTE,IT,,
209007,750460,ISONEO,CLOSED,H2020-EU.1.3.2.,MSCA-IF-2016,Isotopic evidence for diet and mobility during the Neolithic transition to farming in the Near East,2017-10-01T00:00:00Z,2019-10-31T00:00:00Z,https://isoneo.wordpress.com/,The Neolithic transition represents perhaps the most significant development in human history,195454.8,195454.8,UNIVERSITY OF DURHAM,UK,,
201359,705709,ENART,CLOSED,H2020-EU.1.3.2.,MSCA-IF-2015-GF,Engagement Art: Regional Islamic and Global Pragmatist Aesthetics,2016-05-01T00:00:00Z,2019-04-30T00:00:00Z,,ENART is an integrated research and training programme for innovative knowledge transfer and career development,278227.8,278227.8,ROSKILDE UNIVERSITET,DK,,
216022,770017,DEMOBLACK,SIGNED,H2020-EU.1.1.,ERC-2017-COG,Demography of black hole binaries in the era of gravitational wave astronomy,2018-11-01T00:00:00Z,2023-10-31T00:00:00Z,,The first direct detection of gravitational waves demonstrated that double black hole (BH) binaries exist and can host surprisingly massive objects (> 20 solar masses),1994764,1994764,UNIVERSITA DEGLI STUDI DI PADOVA,IT,,
197513,655278,GenoSpec,CLOSED,H2020-EU.1.3.2.,MSCA-IF-2014-EF,Insights from Population Genomics to the Evolution of Host Specificity in Insect Fungi,2015-11-16T00:00:00Z,2017-11-15T00:00:00Z,,GenoSpec aims at understanding the genomic processes underlying host adaptations of the ants-specific fungi from the species complex Ophiocordyceps unilateralis sensu lato by using a population genomics approach,173076,173076,UNIVERSITE PARIS-SACLAY,FR,,
222126,839474,IT-POW FAMILIES,SIGNED,H2020-EU.1.3.2.,MSCA-IF-2018,FAMILIES AND MEMORIES OF ITALIAN PRISONERS OF WAR IN YUGOSLAVIA AFTER WORLD WAR II,2020-05-01T00:00:00Z,2024-04-29T00:00:00Z,,IT-POW FAMILIES is proposing a research on the experience and memory of the families of Italian POWs held in Yugoslavia after WWII,183473.28,183473.28,UNIVERSITA CA' FOSCARI VENEZIA,IT,,
215303,794938,MOVEMED,SIGNED,H2020-EU.1.3.2.,MSCA-IF-2017,Linking Human Mobility and Marine Megafauna Movement in the Mediterranean Sea for a better integration of Blue Growth,2019-01-01T00:00:00Z,2020-12-31T00:00:00Z,,This proposal will investigate the dynamics and links between human mobility and marine megafauna movement using a computationally intensive data-driven approach,183454.8,183454.8,THE UNIVERSITY OF EXETER,UK,,
