rcn,id,acronym,status,programme,topics,title,startDate,endDate,projectUrl,objective,totalCost,ecMaxContribution,coordinator,coordinatorCountry,participants,participantCountries
205328,694323,EYEGET,SIGNED,H2020-EU.1.1.,ERC-ADG-2015,Gene therapy of inherited retinal diseases,2017-01-01T00:00:00Z,2021-12-31T00:00:00Z,,Inherited retinal degenerations (IRDs) are a major cause of blindness worldwide,2499564,2499564,FONDAZIONE TELETHON,IT,,
221962,834923,POPMET,SIGNED,H2020-EU.1.1.,ERC-2018-ADG,Large-scale identification of secondary metabolites metabolic pathways and their genes in the model tree poplar,2019-07-01T00:00:00Z,2024-06-30T00:00:00Z,,Poplar is an important woody biomass crop and at the same time the model of choice for molecular research in trees,2499251.25,2499251,VIB VZW,BE,,
201183,703872,MCANALSMSCA2015,SIGNED,H2020-EU.1.3.2.,MSCA-IF-2015-EF,Receptor signalling in space and time - Gaining high-resolution information of the temporal and spatial control of  G protein-coupled receptor signalling.,2018-11-01T00:00:00Z,2020-10-31T00:00:00Z,,G protein-coupled receptors (GPCRs) are the largest family of cell surface signal transducing proteins encoded by the human genome,183454.8,183454.8,THE UNIVERSITY OF NOTTINGHAM,UK,,
196129,661617,RISTRAD,CLOSED,H2020-EU.1.3.2.,MSCA-IF-2014-EF,Risk Stratification for Sudden Cardiac Death,2015-05-01T00:00:00Z,2017-04-30T00:00:00Z,http://www.umr1087.univ-nantes.fr/julien-barc-2047336.kjsp,Sudden cardiac death (SCD) is a leading cause of total and cardiovascular mortality,173076,173076,INSTITUT NATIONAL DE LA SANTE ET DE LA RECHERCHE MEDICALE,FR,,
204934,706376,INVERTIDAL,CLOSED,H2020-EU.1.3.2.,MSCA-IF-2015-EF,Chromosomal rearrangements and diversification on environmental gradients,2016-09-01T00:00:00Z,2018-08-31T00:00:00Z,https://rmigueldefaria.wixsite.com/farialab-1/invertidal,Chromosomal rearrangements (CRs) are considered to foster adaptation (and speciation) by protecting advantageous combinations of alleles from recombination,183454.8,183454.8,THE UNIVERSITY OF SHEFFIELD,UK,,
209622,750766,MELCA,CLOSED,H2020-EU.1.3.2.,MSCA-IF-2016,Molecular evolution in the double-clonal longhorn crazy ant,2018-01-01T00:00:00Z,2019-12-31T00:00:00Z,https://www.unil.ch/dee/keller-group,The divergent selective pressures experienced by females and males often lead to the evolution of dramatic morphological physiological and behavioural differences,175419.6,175419.6,UNIVERSITE DE LAUSANNE,CH,,
212287,755758,CRISS,SIGNED,H2020-EU.1.1.,ERC-2017-STG,CRISPR Gene Correction for Severe Combined Immunodeficiency Caused by Mutations in Recombination-activating gene 1 and 2 (RAG1 and RAG2),2017-10-01T00:00:00Z,2022-09-30T00:00:00Z,,The severe combined immunodeficiencies (SCIDs) are a set of life threatening genetic diseases in which patients are born with mutations in single genes and are unable to develop functional immune systems,1372839,1372839,BAR ILAN UNIVERSITY,IL,,
214178,796877,SURVIVOR,SIGNED,H2020-EU.1.3.2.,MSCA-IF-2017,Historic response of a wide-ranging carnivore to climate change,2018-06-01T00:00:00Z,2020-11-30T00:00:00Z,,This proposed project investigates novel ways of predicting the effects of future climate change on the survival of animal species,173857.2,173857.2,NATURHISTORISKA RIKSMUSEET,SE,,
195387,657076,HJMIGRA,CLOSED,H2020-EU.1.3.2.,MSCA-IF-2014-EF,Single-molecule analysis of Holliday-junction (HJ) migration by the human double-HJ dissolvasome,2015-05-01T00:00:00Z,2017-04-30T00:00:00Z,http://mk-lab.org,The project outlined here investigates the molecular mechanisms of the critical final steps of homologous recombination (HR) based DNA repair a pathway that supports the error-free repair of double-stranded DNA breaks (DSBs),146239.2,146239.2,EOTVOS LORAND TUDOMANYEGYETEM,HU,,
195945,660417,BRACE,CLOSED,H2020-EU.1.3.2.,MSCA-IF-2014-EF,Breaking down arenavirus cell entry,2015-10-01T00:00:00Z,2017-09-30T00:00:00Z,https://www.nki.nl/divisions/biochemistry/brummelkamp-t-group/,Hemorrhagic fever viruses are serious human threats for which we dont have adequate treatments available which is painfully highlighted by the current Ebola virus outbreak in Western Africa,165598.8,165598.8,STICHTING HET NEDERLANDS KANKER INSTITUUT-ANTONI VAN LEEUWENHOEK ZIEKENHUIS,NL,,
195927,660331,BluGram,TERMINATED,H2020-EU.1.3.2.,MSCA-IF-2014-GF,Identification of genetic factors which determine host specificity in the wheat-powdery mildew pathosystem,2015-09-01T00:00:00Z,,,Powdery mildew caused by the fungus Blumeria graminis f,260674.2,260674.2,UNIVERSITY OF HAIFA,IL,,
204498,695288,Totipotency,SIGNED,H2020-EU.1.1.,ERC-ADG-2015,Transcriptional and Epigenetic Regulation of Totipotency in Mouse Early Embryos.,2016-08-01T00:00:00Z,2021-07-31T00:00:00Z,,In mammals fusion of two highly differentiated gametes gives rise to a totipotent zygote capable of developing into a whole organism,2859560,2859560,FRIEDRICH MIESCHER INSTITUTE FOR BIOMEDICAL RESEARCH FONDATION,CH,,
219512,802531,EvolutioNeuroCircuit,SIGNED,H2020-EU.1.1.,ERC-2018-STG,Cellular and genetic bases of neural circuits evolution,2019-03-01T00:00:00Z,2024-02-29T00:00:00Z,,Sensory systems encode the world around us to produce context-dependent appropriate behaviours,1312500,1312500,THE FRANCIS CRICK INSTITUTE LIMITED,UK,,
202607,682586,illumizymes,SIGNED,H2020-EU.1.1.,ERC-CoG-2015,Illuminating aptamers and ribozymes for biomolecular tagging and fluorogen activation,2016-07-01T00:00:00Z,2021-06-30T00:00:00Z,,RNAs are linear biopolymers that consist of only four types of building blocks but can fold into complex three-dimensional structures that are endowed with selective high-affinity ligand-binding abilities known as aptamers and catalytic activities known as ribozymes,2061250,2061250,JULIUS-MAXIMILIANS-UNIVERSITAT WURZBURG,DE,GEORG-AUGUST-UNIVERSITAT GOTTINGENSTIFTUNG OFFENTLICHEN RECHTS,DE
204743,682473,BCM-UPS,SIGNED,H2020-EU.1.1.,ERC-CoG-2015,Dissecting the role of the ubiquitin proteasome system in the pathogenesis and therapy of B-cell malignancies,2016-09-01T00:00:00Z,2021-08-31T00:00:00Z,,B-cell malignancies are characterized by high levels of genomic instability which critically contribute to their pathogenesis and evolution,1973255,1973255,KLINIKUM RECHTS DER ISAR DER TECHNISCHEN UNIVERSITAT MUNCHEN,DE,,
220882,818806,TALE,SIGNED,H2020-EU.1.1.,ERC-2018-COG,Therapeutic Allele Engineering: A novel technology for cell therapy,2019-06-01T00:00:00Z,2024-05-31T00:00:00Z,,We are currently witnessing a revolution in cell therapies that are routed in decades of basic research in genetics cell biology and immunology,2397082,2397082,UNIVERSITAT BASEL,CH,,
210571,743165,BLASTOFF,SIGNED,H2020-EU.1.1.,ERC-2016-ADG,Retooling plant immunity for resistance to blast fungi,2017-09-01T00:00:00Z,2022-08-31T00:00:00Z,,Plant NLR-type immune receptors tend to have a narrow spectrum of pathogen recognition which is currently limiting their value in agriculture,2491893,2491893,THE SAINSBURY LABORATORY,UK,JOHN INNES CENTRE,UK
193507,637591,NEURAL AS,SIGNED,H2020-EU.1.1.,ERC-StG-2014,Functions and evolutionary impact of transcriptomic novelties in the vertebrate brain,2015-04-01T00:00:00Z,2020-12-31T00:00:00Z,http://vastdb.crg.eu/,Alternative splicing (AS) is the largest contributor to transcriptomic diversification in metazoans,1498852,1498852,FUNDACIO CENTRE DE REGULACIO GENOMICA,ES,,
196848,647320,Enhancer ID,SIGNED,H2020-EU.1.1.,ERC-CoG-2014,Identification and functional characterization of mammalian enhancers and transcriptional co-factors during cellular signaling and cell fate transitions,2015-09-01T00:00:00Z,2021-07-31T00:00:00Z,https://www.imp.ac.at/research/research-groups/alexander-stark/research/,A major goal in biology is to understand how gene regulatory information is encoded by the human genome and how it defines different gene expression programs and cell types,1999906,1999906,FORSCHUNGSINSTITUT FUR MOLEKULARE PATHOLOGIE GESELLSCHAFT MBH,AT,,
208312,726396,OXIDISE,SIGNED,H2020-EU.1.1.,ERC-2016-COG,Interaction and Kinetics of Oxidative Biomass Degrading Enzymes Resolved by High-Resolution Techniques,2017-03-01T00:00:00Z,2022-02-28T00:00:00Z,,Current processes for lignocellulose deconstruction are unspecific and produce some constituents in poor quality,1929319,1929319,UNIVERSITAET FUER BODENKULTUR WIEN,AT,,
195644,658712,GLYCODIS3,CLOSED,H2020-EU.1.3.2.,MSCA-IF-2014-EF,Genetic correction of glycogen debranching enzyme deficiency in Glycogen Storage disease III: a proof of concept study,2016-01-01T00:00:00Z,2017-12-31T00:00:00Z,http://www.genethon.fr/en/,Glycogen storage disease III (GSD III) is a rare (1:100000) autosomal recessive disorder that results from the deficiency of the glycogen debranching enzyme (GDE),173076,173076,ASSOCIATION GENETHON,FR,,
199510,679056,HOTSPOT,SIGNED,H2020-EU.1.1.,ERC-StG-2015,Genomic hotspots of adaptation to whole genome duplication,2016-01-01T00:00:00Z,2021-06-30T00:00:00Z,http://yant.jic.ac.uk/,Whole genome duplication (WGD) occurs in all eukaryotic kingdoms and is implicated in organismal complexity adaptation and speciation,1490329,1490329,THE UNIVERSITY OF NOTTINGHAM,UK,JOHN INNES CENTRE,UK
220616,819314,DCRIDDLE,SIGNED,H2020-EU.1.1.,ERC-2018-COG,A novel physiological role for IRE1 and RIDD... maintaining the balance between tolerance and immunity?,2019-02-01T00:00:00Z,2024-01-31T00:00:00Z,,Dendritic cells (DCs) play a crucial role as gatekeepers of the immune system coordinating the balance between protective immunity and tolerance to self antigens,1999196,1999196,VIB VZW,BE,,
200601,706828,GSR,CLOSED,H2020-EU.1.3.2.,MSCA-IF-2015-EF,Genome surveillance by small non-coding RNAs,2017-01-01T00:00:00Z,2018-12-31T00:00:00Z,https://gsrproject.site123.me/,Water oxygen and sunlight are essential to most forms of life yet they also represent a challenging environment for the genetic material as they drive reactions that lead to damage of DNA,175866,175866,NATIONAL UNIVERSITY OF IRELAND GALWAY,IE,,
212448,776425,AIOSAT,SIGNED,H2020-EU.3.2.1.+H2020-EU.2.1.6.3.+H2020-EU.2.1.6.1.2.,GALILEO-3-2017,Autonomous Indoor  Outdoor SafetyTracking system,2017-12-01T00:00:00Z,2020-09-30T00:00:00Z,http://www.aiosat.eu,The Europe population experiences yearly about 2 million to 2,2032650,1764262.5,ASOCIACION CENTRO TECNOLOGICO CEIT,ES,Inertia Technology B.V.-STICHTING SAXION-ECOLE ROYALE MILITAIRE - KONINKLIJKE MILITAIRE SCHOOL-INTEGRASYS SA-VEILIGHEIDSREGIO TWENTE-HULPVERLENINGSZONE CENTRUM (OOST-VLAANDEREN),NL-BE-ES
225339,865206,ADDIMOT,SIGNED,H2020-EU.3.4.5.6.,JTI-CS2-2018-CfP09-SYS-02-56,ADDitively manufactured limited angle torque MOTor for Smart Active Inceptors,2019-10-01T00:00:00Z,2021-09-30T00:00:00Z,,The main objective of ADDIMOT project is to investigate additive manufacturing (AM) technologies to design and manufacture a new generation of electrical torque motors for their application in Smart Active Inceptors (SAIs),806533.75,698659.38,ASOCIACION CENTRO TECNOLOGICO CEIT,ES,EGILE MECHANICS SL,ES
211966,777465,X2RAIL-2,SIGNED,H2020-EU.3.4.8.2.,S2R-CFM-IP2-01-2017,Enhancing railway signalling systems based on train satellite positioning on-board safe train integrity formal methods approach and standard interfaces enhancing Traffic Management System functions,2017-09-01T00:00:00Z,2020-11-30T00:00:00Z,http://projects.shift2rail.org/s2r_ip2_n.aspx,X2RAIL-2 represents the 2nd proposal of the Shift2Rail members in the IP2 Advanced Traffic Management & Control Systems domain,1.339991679E7,1.339991679E7,HITACHI RAIL STS SPA,IT,DEUTSCHE BAHN AG-BOMBARDIER TRANSPORTATION SWEDEN AB-THALES TRANSPORTATION SYSTEMS GMBH-TRAFIKVERKET - TRV-NETWORK RAIL INFRASTRUCTURE LIMITED-DEUTSCHES ZENTRUM FUR LUFT - UND RAUMFAHRT EV-SIEMENS MOBILITY GMBH-INDRA SISTEMAS SA-HACON INGENIEURGESELLSCHAFT MBH-MER MEC SPA-SNCF RESEAU-CAF SIGNALLING S.L-RAILENIUM-NOTTINGHAM SCIENTIFIC LTD-AZD PRAHA SRO-SCHWEIZERISCHE BUNDESBAHNEN SBB-ALSTOM TRANSPORT SA-SIEMENS AKTIENGESELLSCHAFT-ASOCIACION CENTRO TECNOLOGICO CEIT,DE-SE-UK-ES-IT-FR-CZ-CH
193746,640747,ERSAT EAV,CLOSED,H2020-EU.2.1.6.,GALILEO-1-2014,ERTMS on SATELLITE – Enabling Application  Validation,2015-02-01T00:00:00Z,2017-04-30T00:00:00Z,http://www.ersat-eav.eu/,The main ERSAT EAV objective is to verify the suitability of EGNSS (including EGNOS and Galileo early services) for safety railway application in particular in regional lines scenario for which a safe localization of the trains based on satellite technologies will be defined and developed leading the way for the harmonization with the European ERTMS standard by implementing the solution on a pilot line as reference,5518703.75,4252447.25,HITACHI RAIL STS SPA,IT,RETE FERROVIARIA ITALIANA-DB NETZ AG-TELESPAZIO SPA-TRENITALIA SPA-UNIVERSITA COMMERCIALE LUIGI BOCCONI-CONSORZIO UNIVERSITA INDUSTRIA - LABORATORI DI RADIOCOMUNICAZION I-DEUTSCHES ZENTRUM FUR LUFT - UND RAUMFAHRT EV-ASSTRA - ASSOCIAZIONE TRASPORTI-EUROPEAN SATELLITE SERVICES PROVIDER SAS-SOGEI-SOCIETA GENERALE D'INFORMATICA SPA-ASOCIACION CENTRO TECNOLOGICO CEIT,IT-DE-FR-ES
211965,777402,FR8HUB,SIGNED,H2020-EU.3.4.8.5.,S2R-CFM-IP5-01-2017,Real time information applications and energy efficient solutions for rail freight,2017-09-01T00:00:00Z,2021-02-28T00:00:00Z,http://projects.shift2rail.org/s2r_ip5_n.aspx,The key aspects for this proposal FR8HUB is the emphasis on increasing the efficiency in the nodes hubs and terminals in the railway system for freight and to continue development in freight locomotives of the future,4400000,4400000,TRAFIKVERKET - TRV,SE,HITACHI RAIL STS SPA-DEUTSCHE BAHN AG-VERBAND DER BAHNINDUSTRIE IN DEUTSCHLAND (VDB) EV-CONTRAFFIC GMBH-CAF POWER & AUTOMATION SL-DEUTSCHES ZENTRUM FUR LUFT - UND RAUMFAHRT EV-VIRTUAL VEHICLE RESEARCH GMBH-INDRA SISTEMAS SA-AVL LIST GMBH-BOMBARDIER TRANSPORTATION GMBH-OBB-Infrastruktur  AG-SCHWEIZERISCHE BUNDESBAHNEN SBB-ASOCIACION CENTRO TECNOLOGICO CEIT,IT-DE-ES-AT-CH
201294,705108,HippBoundariesPE,CLOSED,H2020-EU.1.3.2.,MSCA-IF-2015-EF,Identifying the building blocks of episodic memory: how the hippocampus parses boundless experience into discrete events,2016-08-18T00:00:00Z,2018-08-17T00:00:00Z,https://www.mrc-cbu.cam.ac.uk/people/aya.ben-yakov/,Life provides us with a continuous stream of information that ends up being organized in long-term memory as distinct events,183454.8,183454.8,THE CHANCELLOR MASTERS AND SCHOLARSOF THE UNIVERSITY OF CAMBRIDGE,UK,UNITED KINGDOM RESEARCH AND INNOVATION,UK
223717,832620,GPCR Transcriptomics,SIGNED,H2020-EU.1.3.2.,MSCA-IF-2018,Exploring the role of GPCR expression diversity in receptor physiology and drug response,2019-05-01T00:00:00Z,2021-04-30T00:00:00Z,,G protein coupled receptors (GPCRs) are key regulators of cell homeostasis,212933.76,212933.76,UNITED KINGDOM RESEARCH AND INNOVATION,UK,,
208427,739573,HiLASE CoE,SIGNED,H2020-EU.4.a.,WIDESPREAD-01-2016-2017,HiLASE Centre of Excellence,2017-04-01T00:00:00Z,2022-09-30T00:00:00Z,http://www.hilase.cz/en/hilasecoe/,Czech Republic has invested €32M in the construction of an advanced next generation laser facility HiLASE at Dolní Břežany in Central Bohemia Region,10027871,10027871,FYZIKALNI USTAV AV CR V.V.I,CZ,UNITED KINGDOM RESEARCH AND INNOVATION,UK
218792,821328,IDEN,SIGNED,H2020-EU.3.4.5.2.,JTI-CS2-2017-CfP07-REG-01-15,Innovative Distributed Electrical Network,2018-10-01T00:00:00Z,2020-11-30T00:00:00Z,https://www.nottingham.ac.uk/aerospace/projects/cleansky/iden-project.aspx,With the introduction of the more electric aircraft greater emphasis is placed on the power generation and distribution architecture as a result of increased power demands and higher efficiency needs as well as the interest in using electrical power for more flight critical applications,1399037.5,1399037.5,BLU ELECTRONIC SRL,IT,FUNDACION TECNALIA RESEARCH & INNOVATION-THE UNIVERSITY OF NOTTINGHAM-ASOCIACION CENTRO TECNOLOGICO CEIT,ES-UK
217257,827457,Blocknetwork,SIGNED,H2020-EU.3.+H2020-EU.2.3.+H2020-EU.2.1.,EIC-SMEInst-2018-2020,Blocknetwork - Fusing Big Data and Implementing Novel Cyber Security Solutions,2018-09-01T00:00:00Z,2019-02-28T00:00:00Z,http://www.dataunitor.com/products-services/ephesus/,Data science is a driving force in todays information age,71429,50000,DATAUNITOR AS,NO,,
214253,780251,TYPHON,SIGNED,H2020-EU.2.1.1.,ICT-16-2017,Polyglot and Hybrid Persistence Architectures for Big Data Analytics,2018-01-01T00:00:00Z,2020-12-31T00:00:00Z,http://www.typhon-project.org,The need for levels of availability and scalability beyond those supported by relational databases has led to the emergence of a new generation of purpose-specific databases grouped under the term NoSQL,4499447.5,4499447.5,X/OPEN COMPANY LIMITED,UK,ALPHA BANK ANONYMOS ETAIRIA-INSTITUT FÜR ANGEWANDTE SYSTEMTECHNIK BREMEN GMBH-STICHTING CENTRUM VOOR WISKUNDE EN INFORMATICA-EDGE HILL UNIVERSITY-SWAT ENGINEERING BV-UNIVERSITY OF YORK-ORGANISMOS TILEPIKOINONION TIS ELLADOS OTE AE-UNIVERSITA DEGLI STUDI DELL'AQUILA-NEA ODOS ANONYMI ETERIA PARAHORISIS (Nea Odos Concessionaire S.A.)-VOLKSWAGEN AG-STICHTING NEDERLANDSE WETENSCHAPPELIJK ONDERZOEK INSTITUTEN-ZORGIOS IOANNIS-UNIVERSITE DE NAMUR ASBL-GMV AEROSPACE AND DEFENCE SA,EL-DE-NL-UK-IT-BE-ES
206401,732630,BDVe,SIGNED,H2020-EU.2.1.1.,ICT-17-2016-2017,Big Data Value ecosystem,2017-01-01T00:00:00Z,2020-12-31T00:00:00Z,http://www.big-data-value.eu,The mission of BDVe is to support the Big Data Value PPP in realizing a vibrant data-driven EU economy or said in other words BDVe will support the implementation of the PPP to be a SUCCESS,4940286.25,4940286.25,SAP SE,DE,NATIONAL UNIVERSITY OF IRELAND GALWAY-NEDERLANDSE ORGANISATIE VOOR TOEGEPAST NATUURWETENSCHAPPELIJK ONDERZOEK TNO-BIG DATA VALUE-UNIVERSITAET DUISBURG-ESSEN-ATOS SPAIN SA-OGILVYONE WORLDWIDE SA-TILDE SIA-UNIVERSIDAD POLITECNICA DE MADRID-SIEMENS AKTIENGESELLSCHAFT-EIT DIGITAL,IE-NL-BE-DE-ES-LV
201725,717857,ZephyCloud,CLOSED,H2020-EU.3.3.+H2020-EU.2.3.1.,SIE-01-2015-1,Making Wind Energy More Bankable…Faster!,2016-03-01T00:00:00Z,2016-07-31T00:00:00Z,http://www.zhephycloud.com,At Meteopole we set our sights on making the wind energy sector more profitable by maximising the economic value of the wind energy site through optimising wind quality and quantity and de-risking market and performance uncertainties,71429,50000,ZEPHY-SCIENCE,FR,,
212126,759764,BigEarth,SIGNED,H2020-EU.1.1.,ERC-2017-STG,Accurate and Scalable Processing of Big Data in Earth Observation,2018-04-01T00:00:00Z,2023-03-31T00:00:00Z,,During the last decade a huge number of earth observation (EO) satellites with optical and Synthetic Aperture Radar sensors onboard have been launched and advances in satellite systems have increased the amount variety and spatial/spectral resolution of EO data,1491479,1491479,TECHNISCHE UNIVERSITAT BERLIN,DE,UNIVERSITA DEGLI STUDI DI TRENTO,IT
201762,718990,LINGOKIDS,CLOSED,H2020-EU.2.1.1.+H2020-EU.2.3.1.,ICT-37-2015-1,LINGOKIDS: Adaptive mobile platform for language learning for early age children,2016-04-01T00:00:00Z,2016-09-30T00:00:00Z,http://www.lingokids.com,Because of the globalisation language learning and bilingualism has been introduced in education from the earliest years of schooling,71429,50000,MONKIMUN LABS SL,ES,,
196189,662652,BigDataScore,CLOSED,H2020-EU.2.1.1.+H2020-EU.2.3.1.,ICT-37-2014-1,Improving loan quality and acceptance rates by predicting credit behavior through social mediadata.,2015-03-01T00:00:00Z,2015-06-30T00:00:00Z,,The problem: Credit Losses on Banks Loan Portfolios - Youngsters and 2nd generation immigrants still have difficulty in obtaining credit,71429,50000,BIG DATA SCORING,EE,AASA GLOBAL AS,EE
204866,695107,DYNURBAN,SIGNED,H2020-EU.1.1.,ERC-ADG-2015,Urban dynamics: learning from integrated models and big data,2016-08-01T00:00:00Z,2021-07-31T00:00:00Z,https://diegopuga.org,City growth is driven by a combination of systematic determinants and shocks,1292586.25,1292586.25,FUNDACION CENTRO DE ESTUDIOS MONETARIOS Y FINANCIEROS,ES,,
218097,770839,PARENTIME,SIGNED,H2020-EU.1.1.,ERC-2017-COG,PARENTAL TIME INVESTMENTS AND INTERGENERATIONAL TRANSMISSION OF INEQUALITY,2018-09-01T00:00:00Z,2023-08-31T00:00:00Z,,High socio-economic status parents consistently produce high socio-economic status children,1960098,1960098,UNIVERSITY COLLEGE LONDON,UK,,
214774,777455,IoT4Industry,SIGNED,H2020-EU.2.3.2.2.+H2020-EU.2.3.2.3.,INNOSUP-01-2016-2017,Towards smarter means of production in European manufacturing SMEs through the use of the Internet of Things technologies,2018-04-01T00:00:00Z,2020-12-31T00:00:00Z,http://www.iot4industry.eu,The proportion of the manufacturing industry is currently decreasing in developed European countries GDP,4962500,4852812.5,POLE SOLUTIONS COMMUNICANTES SECURISEES,FR,GAC-AUVERGNE RHONE-ALPES INDUSTRIE-INNO TSD-MICROTEC SUDWEST EV-CENTRO SERVIZI INDUSTRIE SRL-POLE MECATECH-DSP VALLEY VZW-THE MANUFACTURING TECHNOLOGY CENTRE LIMITED,FR-DE-IT-BE-UK
208214,743761,Ro-Boost Inno SMEs,SIGNED,H2020-EU.2.3.,H2020-SGA2-EEN,RO-Boost Inno SMEs – Boosting the Innovative Potential of Romanian SMEs,2017-01-01T00:00:00Z,2018-12-31T00:00:00Z,http://www.eenroboost.ro/,In the context of innovation-divided Europe and scarce consultancy in RDI Macro Region 4 Romania is in full process of moving towards a turning point of economic positioning in a climate of globalization disruptive innovations and circular economies,56546.25,56281,REGIONAL DEVELOPMENT AGENCY OF THE WEST REGION ROMANIA,RO,UNIVERSITATEA DIN CRAIOVA-ASOCIATIA TEHIMPULS-CENTRUL REGIONAL DE INOVARE SI TRANSFER TEHNOLOGIC-ASOCIATIA CENTRUL DE DEZVOLTARE ARAD-AGENTIA PENTRU DEZVOLTARE REGIONALA SUD-VEST OLTENIA,RO
217587,816348,ESKAM,SIGNED,H2020-EU.3.+H2020-EU.2.3.+H2020-EU.2.1.,EIC-SMEInst-2018-2020,Electric Scalable Axle Module for e-Mobility,2018-05-01T00:00:00Z,2018-10-31T00:00:00Z,https://www.groschopp.de/loesungen/EMobility,An increasing trend toward electrically powered vehicles can now be discerned worldwide,71429,50000,GROSCHOPP AKTIENGESELLSCHAFT DRIVES & MORE,DE,,
198937,698688,WATLY,CLOSED,H2020-EU.3.5.+H2020-EU.2.3.1.,SC5-20-2015,An autonomous and mobile water treatment plant powered by solar energy,2015-10-01T00:00:00Z,2017-10-31T00:00:00Z,http://watly.co/,Water and energy are highly interdependent and are both crucial to human well-being and sustainable socio-economic development,2025500,1417850,ENRY'S PLEX SL,ES,,
197422,684915,INSWITCH,CLOSED,H2020-EU.3.3.+H2020-EU.2.3.1.,SIE-01-2015-1,InSwitch – Ultra-Compact Electronic Solid-State Device for  Induction Motor Starting and Performance Improvement,2015-07-01T00:00:00Z,2015-12-31T00:00:00Z,http://www.optisigma.pt,The proposed feasibility study respects to a project to develop manufacture and commercialize worldwide of an ultra-compact self-powered electronic solid-state device for optimized soft-starting and steady-state performance improvement of fixed-speed three-phase squirrel-cage induction motors by means of a novel automatic load-based stator winding connection-mode management technique,71429,50000,OPTISIGMA - ENERGIA & AMBIENTE LDA,PT,,
215160,793449,WEBOING,SIGNED,H2020-EU.1.3.2.,MSCA-IF-2017,UWB wearable apparatus for bone fracture imaging and recovering monitoring,2018-11-01T00:00:00Z,2020-10-31T00:00:00Z,,Global changes in healthcare funding an increasingly ageing demographic explosions of new technologies are converging to transform our relationship with healthcare,195454.8,195454.8,LONDON SOUTH BANK UNIVERSITY LBG,UK,,
224873,874205,VETEX,SIGNED,H2020-EU.3.+H2020-EU.2.3.+H2020-EU.2.1.,EIC-SMEInst-2018-2020,Deep Vein Thrombosis A Paradigm Change in Treatment through Drug-Free Clot Removal,2019-05-01T00:00:00Z,2021-04-30T00:00:00Z,http://www.vetexmedical.com,Deep Vein Thrombosis is the 3rd leading cardiovascular disease behind heart attack and stroke with 1,3550920,2485644,VETEX MEDICAL LIMITED,IE,,
208527,739763,INNO-CYANO,SIGNED,H2020-EU.2.3.2.2.,INNOSUP-02-2016,INNOvative mapping reporting and forecasting of CYANObacteria blooms applying the synergistic use of advanced in situ optical data satellite imagery and statistical modelling,2017-09-01T00:00:00Z,2018-08-31T00:00:00Z,http://www.waterinsight.nl,Water Insight (WI) specialises in high quality spatial information products for monitoring surface water quality applying the synergistic use of Earth Observation (EO) and optical in situ measurements,83042.5,83042.5,WATER INSIGHT BV,NL,,
225881,824206,inDemand-RCT,SIGNED,H2020-EU.2.3.2.2.,INNOSUP-06-2018,Demand-driven and business co-creation for a new innovation business model,2019-12-01T00:00:00Z,2022-11-30T00:00:00Z,,Explore & experiment a new business demand-driven model based on co-creation patterns between customers & Smes,497500,497500,INSTITUTO DE FOMENTO DE LA REGION DE MURCIA,ES,,
218405,825797,ULTRAFORS,SIGNED,H2020-EU.1.1.,ERC-2018-PoC,Ultracoherent force sensors,2018-11-01T00:00:00Z,2020-04-30T00:00:00Z,,As part of our ERC-funded quest for quantum-enabled micro- and nanomechanical resonators we have developed a novel type of soft-clamped mechanical sensors,150000,150000,KOBENHAVNS UNIVERSITET,DK,,
216758,811499,PUPILOSCOPE,SIGNED,H2020-EU.3.+H2020-EU.2.3.+H2020-EU.2.1.,EIC-SMEInst-2018-2020,Pupiloscope a Neuro-Critical Care Device Enabling Quantitative Real-Time Pupillary Monitoring and Assessment of Patients with Neurotrauma and Head Injuries.,2018-06-01T00:00:00Z,2020-09-30T00:00:00Z,http://www.pupiloscope.com,An estimated 42 million people Worldwide suffer a Head Injury (2,1250911.25,875637.88,VIVO SMART MEDICAL DEVICES LTD,UK,,
